id,Sentence,Entities
460,"China's official Xinhua news agency says archaeologists have discovered the ruins of 29 villages that date back more than 4,500 years.","China, Xinhua"
461,The report said the ancient communities were discovered in the northern part of Shaanxi province a region known for its archaeological treasures.,Shaanxi
462,Xinhua says the ruins show that people had mastered building techniques and had constructed houses and stone walls around their community.,Xinhua
464,The report quoted an official with the Shaanxi Provincial Archaeological Research Institute as saying the discovery will help scientists better understand the environment during the Neolithic period also known as the New Stone Age.,Shaanxi Provincial Archaeological Research Institute
465,A United Nations expert on extrajudicial killings says he would like to visit Thailand to investigate last month's deaths of 87 Muslim protesters.,"United Nations, Thailand, Muslim"
466,Philip Alston said he is deeply concerned by the October 25 incident.,Philip Alston
467,He said a visit to Thailand would allow him to speak with those involved and to recommend ways to bring peace and stability to the region.,Thailand
468,Thailand has not responded to Mr. Alston's request.,Mr. Alston
469,Meanwhile Thailand's revered King Bhumibol Adulyadej warned that the country could fall into ruin if the violence in the south does not end.,King Bhumibol Adulyadej
471,Hundreds of people have been killed since January when an insurgency flared up in Thailand's three Muslim-majority southern provinces.,Thailand
472,Israeli soldiers have killed two Palestinians in the southern Gaza Strip.,Gaza Strip
473,Witnesses say the two men were killed early Friday near the security barrier separating southern Gaza with Israel.,"Gaza, Israel"
476,Israeli soldiers killed five Palestinians Thursday during an army operation in the West Bank city of Nablus.,"West Bank, Nablus"
477,Officials say three of the dead were wanted militants from the al-Aqsa Martyrs'Brigades a violent offshoot of the mainstream Fatah Party.,"al-Aqsa Martyrs ' Brigades, Fatah Party"
478,Palestinian President Mahmoud Abbas and incoming Hamas Prime Minister Ismail Haniyeh Friday denounced the Israeli military's sweep through the Nablus refugee camps.,"President Mahmoud Abbas, Hamas, Prime Minister Ismail Haniyeh, Nablus"
479,The head of U.S. troops in the Horn of Africa says terrorists and insurgents may begin leaving war zones in Afghanistan and Iraq and head for east Africa.,"Horn, Africa, Afghanistan, Iraq, Africa"
480,Major General Timothy Ghormley says officials are concerned that instability and weak governments in east Africa could draw international terrorist groups seeking to establish a base of operations.,"Major General Timothy Ghormley, Africa"
481,General Ghormley says the joint task force in Djibouti has been helping to train foreign soldiers and build anti-terrorist capabilities of governments in the region.,"General Ghormley, Djibouti"
482,However U.S. forces have yet to enter Somalia which has been without a functioning central government for more than 10 years.,Somalia
483,Earlier this year Ethiopian Prime Minister Meles Zenawi warned an al-Qaida cell is already operating out of Somalia's capital Mogadishu.,"Prime Minister Meles Zenawi, al-Qaida, Mogadishu"
484,Ugandan Lord's Resistance Army rebels are seeking a 12-month suspension in the arrest warrants against their leaders issued by the International Criminal Court.,"Lord 's Resistance Army, International Criminal Court"
485,James Obita the technical advisor to the rebels'negotiating team tells VOA the rebels will ask for the suspension when peace talks with the Ugandan government resume Thursday in Juba southern Sudan.,"James Obita, VOA, Juba, Sudan"
486,"He says in connection with that request the rebels will propose an"" alternative justice system"" to deal with war crimes committed during the rebels'20-year uprising in northern Uganda.",Uganda
487,LRA fighters are accused of killing and mutilating thousands of civilians during the conflict.,LRA
488,The International Criminal Court has indicted five top rebel leaders on war crimes charges.,International Criminal Court
489,The LRA has demanded those charges be dropped as a condition for signing any peace deal.,LRA
491,A group linked to al-Qaida in Iraq is denying Iraqi government reports that its leader was recently arrested.,"al-Qaida, Iraq"
492,The Islamic State of Iraq says the man it claims is its leader Abu Omar al-Baghdadi is fine.,"Iraq, Abu Omar al-Baghdadi"
493,The group says on an Islamist Web site it does not know the person who Iraqi authorities arrested last month and presented as al-Baghdadi.,al-Baghdadi
494,The Iraqi army said it captured the Sunni insurgent leader in the Iraqi capital Baghdad.,"Sunni, Baghdad"
497,In addition U.S. military commander General Kevin Bergner previously had said al-Baghdadi may not be a real person but rather a fictional character created to put an Iraqi face on the otherwise foreign leadership of al-Qaida in Iraq.,"General Kevin Bergner, al-Baghdadi, al-Qaida, Iraq"
498,U.S. military officials have announced changes to military trials of terrorism suspects being held at the U.S. naval base in Guantanamo Bay Cuba.,"Guantanamo Bay, Cuba"
499,"Air Force Brigadier General Thomas Hemingway said Wednesday the so-called"" improvements"" will bring the process closer to the American judge-and-jury system.","Air Force, Brigadier General Thomas Hemingway"
502,U.S. military officials have filed charges against four detainees at Guantanamo where more than 500 terror suspects are being held.,Guantanamo
503,Meantime Center for Constitutional Rights said some prisoners have launched a hunger strike to protest their conditions.,Center for Constitutional Rights
504,A landmine blast in southern Afghanistan has killed nine Afghan soldiers.,Afghanistan
505,The Taleban later claimed responsibility for the blast in Kandahar province.,"Taleban, Kandahar"
506,An Afghan Army spokesman said the troops were traveling towards the nearby Pakistani border when their vehicle hit the mine.,Army
507,U.S.-led forces are hunting down remnants of Afghanistan's ousted Taleban regime who frequently carry out hit and run attacks on coalition and Afghan government forces mainly in the country's eastern and southern regions.,"Afghanistan, Taleban"
508,Four key Palestinian militant groups say they are ending a truce aimed at easing attacks on Israel.,Israel
509,In separate statements issued Sunday Hamas and the Popular Resistance Committees said they were no longer bound by the truce deal brokered last March by Palestinian Authority President Mahmoud Abbas.,"Hamas, Popular Resistance Committees, Palestinian Authority, President Mahmoud Abbas"
510,The al-Aqsa Martyrs Brigades and Islamic Jihad also scrapped the deal and said they had fired rockets early today into southern Israel.,"al-Aqsa Martyrs Brigades, Islamic Jihad, Israel"
511,In a separate development gunmen in the Gaza Strip stormed a club for United Nations workers and blew up a hall where alcohol was served.,"Gaza Strip, United Nations"
513,A short while later gunmen in Gaza kidnapped an Italian activist near Khan Younis but later released him.,"Gaza, Khan Younis"
514,Coalition troops in Iraq have captured a suspected al-Qaida terrorist during a raid on the home of a senior Sunni Arab politician Adnan al-Dulaymi.,"Iraq, al-Qaida, Sunni Arab, Adnan al-Dulaymi"
515,U.S. officials say they believe the man was involved in planning car bomb attacks on Baghdad's Green Zone which houses government diplomatic and military offices.,"U.S., Baghdad, Green Zone"
516,The man is identified as a bodyguard at Mr. Dulaymi's home in the Iraqi capital.,Mr. Dulaymi
518,On Friday Iraqi authorities imposed a curfew in Baghdad because of fears of new violence.,Baghdad
520,In the northern city of Tal Afar a car bomb exploded Saturday killing two people and wounding 30 others.,Tal Afar
521,The U.S. military says the Iraqi army has captured three suspected al-Qaida in Iraq leaders involved in roadside bomb attacks.,"al-Qaida, Iraq"
522,Statements Wednesday say the suspects were detained in separate operations north of Baghdad in Kirkuk province and in the towns of Tarmiyah and Judaidah.,"Baghdad, Kirkuk, Tarmiyah, Judaidah"
523,The military says U.S. Special Forces advised the Iraqi army in all three operations.,U.S. Special Forces
524,The U.S. military also says Iraqi special operations forces detained seven suspected criminals in and around Baghdad's Sadr City district a stronghold of radical Shi'ite cleric Moqtada al-Sadr.,"Baghdad, Sadr City, Shi'ite, Moqtada al-Sadr"
525,U.S. and Iraqi soldiers have been fighting Shi'ite militants in Sadr City in recent weeks as part of a crackdown on illegal militias.,"Shi'ite, Sadr City"
526,The United Nations reports a halt to international aid work in the displaced persons'camps of Zalinge in Sudan's Darfur region.,"United Nations, Zalinge, Sudan, Darfur"
527,The U.N. refugee agency says international groups suspended their activities in the camps after a mob killed three water workers on Thursday.,U.N.
529,"Friday spokesman Ron Redmond said agency is"" extremely concerned"" about what he called the continued deterioration in Darfur's security situation.","Ron Redmond, Darfur"
530,Redmond listed a number of attacks on relief groups over the past week including one where an aid worker was shot dead in North Darfur.,"Redmond, North Darfur"
531,World leaders have been pressing Sudan to accept a U.N. peacekeeping force in Darfur.,"U.N., Darfur"
532,"The government is still rejecting any U.N. deployment to the region where more than three years of violence has killed nearly 2,00,000 people and displaced some two million others.",U.N.
533,Iraq's parliament has approved six new government ministers including four from the country's Sunni minority which held power under Saddam Hussein.,"Sunni, Saddam Hussein"
534,However the Sunni Human Rights appointee Hashem Ashibli quickly turned down the post leaving a single vacancy in the 33-member cabinet.,"Sunni Human Rights, Hashem Ashibli"
536,A Sunni Arab Saadoun al-Dulaimi has been approved as defense minister and a Shi'ite (Ibrahim Bahr al-Uloum) will head the all-important oil ministry.,"Saadoun al-Dulaimi, Ibrahim Bahr al-Uloum"
538,Meanwhile Iraqi police say gunmen assassinated a senior member of the Transportation Ministry Zoba Yass and his driver today in Baghdad.,"Transportation Ministry, Zoba Yass, Baghdad"
539,Separately U.S. officials say coalition forces killed six insurgents and captured 54 suspects early Sunday near the western border town of al-Qaim.,al-Qaim
547,At least 17 people including seven children were killed and more than 70 others wounded in an explosion Monday at a home used for religious education in Pakistan's Punjab province.,"Pakistan, Punjab"
548,Officials in the Mian Channu area said they believe the blast which also flattened more than 20 nearby houses was caused by a cache of explosives stored in the house.,Mian Channu
550,The house belongs to a Muslim cleric who has been accused of recruiting fighters for a banned militant group.,Muslim
552,Pakistani Prime Minister Yusuf Raza Gilani condemned the blast and ordered an inquiry into the incident.,Prime Minister Yusuf Raza Gilani
553,A U.S. immigration judge has denied bail for Luis Posada Carriles an asylum-seeking former CIA operative from Cuba.,"Luis Posada Carriles, CIA, Cuba"
554,U.S. authorities arrested the 77-year-old Posada Carriles in May after he illegally entered the country through Mexico.,"Posada Carriles, Mexico"
555,Posada Carriles is wanted in Venezuela for his alleged role in a 1976 Cuban airliner bombing that killed 73 people.,"Posada Carriles, Venezuela"
559,Pakistani President Pervez Musharraf has sought the support of Pakistanis in the fight against religious extremism and terrorism.,President Pervez Musharraf
561,"In a broadcast address to the nation Thursday General Musharraf promised"" stern action"" against those involved in the printing publication and distribution of hate material including newspapers magazines pamphlets and audio and video material.",General Musharraf
564,General Musharraf said all madrassas in Pakistan must be registered with the government by the end of this year.,"General Musharraf, Pakistan"
566,The changes proposed by the U.S. Centers for Disease Control would apply to planes and ships arriving from outside the United States as well as some domestic flights.,"Centers for Disease Control, United States"
567,The CDC also called for giving U.S. health officials more authority to administer medical treatment and vaccinations to quarantined people.,CDC
569,The proposals come amid growing concern about the spread of bird flu which has killed more than 60 people in Asia since 2003.,Asia
570,Pakistani police have arrested four alleged members of an Islamic militant group in connection with the murder of a prominent Shi'ite Muslim cleric earlier this year.,Shi'ite Muslim
571,A senior police official Saud Aziz says the four wanted in connection with the slaying of Agha Ziauddin in the town of Gilgit in January were picked up in the city of Rawalpindi.,"Saud Aziz, Agha Ziauddin, Gilgit, Rawalpindi"
573,The official says the suspects belong to the Sunni Muslim Lashkar-e-Jhangvi and that they were plotting to attack Shi'ite events last week but changed their minds because of tight security.,"Sunni Muslim Lashkar-e-Jhangvi, Shi'ite"
574,The banned group is accused of killing hundreds of Pakistani Shi'ite Muslims in recent years and is believed to have links to the al-Qaida terrorist network.,"Shi'ite Muslims, al-Qaida"
575,"The name"" Latvia"" originates from the ancient Latgalians one of four eastern Baltic tribes that formed the ethnic core of the Latvian people (ca. 8th - 12th centuries A.D.).","Latgalians, Baltic"
580,Latvia joined both NATO and the EU in the spring of 2004.,"NATO, EU"
581,Bolivia is one of the poorest and least developed countries in Latin America.,Latin America
586,Nevertheless Bolivia recorded the highest growth rate in South America that year.,South America
589,Autonomy for the Swazis of southern Africa was guaranteed by the British in the late 19th century; independence was granted in 1968.,Africa
590,Student and labor unrest during the 1990s pressured King MSWATI III the world's last absolute monarch to grudgingly allow political reform and greater democracy although he has backslid on these promises in recent years.,King MSWATI III
592,The African United Democratic Party tried unsuccessfully to register as an official political party in mid 2006.,United Democratic Party
597,Manpower was replaced with the importation of contract laborers from India between 1845 and 1917 which boosted sugar production as well as the cocoa industry.,India
598,The discovery of oil on Trinidad in 1910 added another important export.,Trinidad
600,The country is one of the most prosperous in the Caribbean thanks largely to petroleum and natural gas production and processing.,Caribbean
601,Tourism mostly in Tobago is targeted for expansion and is growing.,Tobago
618,The fate of seven suspected Somali pirates who were captured by a Spanish warship is uncertain after Spanish prosecutors reversed plans to bring them to Spain to face trial.,Spain
619,A Spanish judge Fernando Andreu ordered the Somali men released on Friday.,Fernando Andreu
620,However he refused the prosecution's request to surrender them to Kenyan authorities saying it would violate the law since proceedings were already taking place in Spain.,Spain
621,A Spanish ship seized the men off the coast of Somalia Wednesday after their boat capsized during their alleged attempt to hijack a Panamanian-flagged vessel.,Somalia
622,France is prosecuting 15 piracy suspects in its own courts though it has transferred others to Kenya including 11 who were handed over on Friday.,"France, Kenya"
623,"China says it punished more than 1,200 health workers last year for such corruption as taking commissions from drug companies and accepting bribes from patients.",China
624,The official Xinhua news agency says investigators from China's Health Ministry uncovered more than 200 cases of hospital staff members buying and selling medicine for personal profit.,"Xinhua, China, Health Ministry"
628,China's Health Minister Gao Qiang said at a nationwide health meeting Saturday that most hospital staff members are doing a good job.,"China, Health Minister Gao Qiang"
630,A vault built to safeguard seed samples of the world's important food crops has opened in the remote Norwegian archipelago of Svalbard.,Svalbard
631,Norway's Prime Minister Jens Stoltenberg and Nobel-Prize winning environmentalist Wangari Maathai on Tuesday placed the first seeds inside the vault built in caverns 130 meters inside a frozen mountain.,"Jens Stoltenberg, Wangari Maathai"
636,More than two dozen Iraqi civilians and policemen have been killed in a wave of bombings Wednesday in Baghdad and parts of central and northern Iraq meant to intimidate voters less than two weeks ahead of national elections.,"Baghdad, Iraq"
637,Five bomb attacks were carried out in Baghdad.,Baghdad
638,Wanted terrorist Abu Musab al-Zarqawi's group (al-Qaida in Iraq) claimed responsibility for four of them including one outside the Australian embassy.,"Abu Musab, al-Zarqawi, al-Qaida, Iraq"
639,The U.S. military reported at least 26 people were killed and many others wounded in those blasts.,U.S.
640,North of the capital in Kirkuk police say a human rights activist and a relative were killed while in Irbil a bomb targeted the convoy of the police academy chief killing a bystander.,"North, Kirkuk, Irbil"
641,And in Dohuk the provincial governor escaped injury when a bomb hit his convoy.,Dohuk
642,A policeman was also killed in a car bombing south of Baghdad near Hilla.,"Baghdad, Hilla"
643,An Israeli airstrike in the Gaza Strip has killed a top Islamic Jihad commander and at least six other people a day after an Islamic Jihad suicide bomber killed five people in central Israel.,"Gaza Strip, Islamic Jihad, Islamic Jihad, Israel"
644,The Israeli military confirmed the Thursday evening helicopter strike near the Jabaliya refugee camp saying it targeted an Islamic Jihad militant.,"Jabaliya, Islamic Jihad"
645,Palestinians identified him as Shahdi Mohanna the Islamic Jihad commander for the northern Gaza Strip.,"Shahdi Mohanna, Islamic Jihad, Gaza Strip"
646,They said three other Islamic Jihad activists and three civilians were also among the dead and at least 15 people were wounded.,Islamic Jihad
647,Earlier Thursday Israeli Prime Minister Ariel Sharon announced an offensive he said would not stop until the Palestinian Authority moves decisively to stop militant attacks.,Prime Minister Ariel Sharon
648,He also said he will not hold talks with Palestinian leader Mahmoud Abbas until the attacks stop.,Mahmoud Abbas
649,A draft peace proposal under consideration by the Afghan government could offer Taliban leaders exile overseas if they agree to stop fighting.,Taliban
650,"The draft plan seen by reporters for British news organizations Reuters and the Guardian newspaper also calls for"" de-radicalization"" classes for insurgents and thousands of new jobs to be created for militants who renounce violence.","Reuters, Guardian"
651,The proposal comes weeks before a grand council of Afghans known as a jirga meets in Kabul on May 29 to discuss how to make peace with the insurgents.,Kabul
652,Possible peace talks will be a key issue discussed when Afghan President Hamid Karzai meets with U.S. President Barack Obama in Washington this week.,"President Hamid Karzai, Barack Obama, Washington"
653,Russia has ordered its fleet of Su-24 bombers grounded after one of the planes crashed during a training mission.,Russia
654,Air force officials said Thursday that a technical problem caused the early morning accident in the Far East Khabarovsk territory.,"Air force, Far East Khabarovsk"
660,Pro-Russian demonstrators in Crimea have protested against the arrival of a U.S. naval frigate in Sevastopol the Ukrainian port where Russia's Black Sea fleet is based.,"Crimea, U.S., Sevastopol, Russia"
661,"News-agency reports from Sevastopol say the demonstrators shouted"" NATO out"" and"" Yankee go home"" during their protest Wednesday.","Sevastopol, NATO"
662,Ukraine's navy says the U.S. naval vessel is on a friendly visit to the Black Sea and is not taking part in any military exercises.,"Ukraine, U.S., Black Sea"
663,Sevastopol's naval base dates back to Soviet times.,Sevastopol
664,Through a lease agreement with Ukraine Russia will operate the facility until 2017.,"Ukraine, Russia"
665,Ukraine's campaign to win NATO membership has been strongly opposed by Moscow which says it will not accept any further expansion of the western alliance on Russia's borders.,"Ukraine, NATO, Moscow, Russia"
666,Egypt's largest opposition group defied authorities and held anti-government protests in Cairo Sunday.,Cairo
667,Several thousand riot police prevented the Muslim Brotherhood from holding a rally outside the Egyptian parliament as planned.,Muslim Brotherhood
668,Instead members of the group gathered in front of a Cairo mosque shouting demands for political reforms.,Cairo
671,Smaller protests took place at two other Cairo locations.,Cairo
672,Egyptian authorities had arrested another 50 Brotherhood members before the protests.,Brotherhood
673,The Muslim Brotherhood calls for replacing Egypt's secular government with an Islamic state.,"Muslim Brotherhood, Egypt"
674,The group was formally banned in 1954 but its members running in elections as independents hold enough seats to make the Brotherhood the largest opposition group in Egypt's parliament.,"Brotherhood, Egypt"
675,Russia says it is commissioning its first unit of new mobile intercontinental ballistic missiles.,Russia
677,Ivanov said the missiles will form the core of Russia's strategic missile forces.,"Ivanov, Russia"
682,A massive blast at an ammunition shop in Afghanistan's capital leveled shops and homes killing at least six people and wounding around nine others.,Afghanistan
684,Descriptions of the scope of the damage vary with reports saying several to 25 buildings in Kabul were destroyed.,Kabul
686,Also Wednesday a suicide bomber in eastern Afghanistan blew himself up near a police convoy.,eastern Afghanistan
687,Police officers in Khost said at least four civilians were killed and more than 30 other people were injured among them Afghan policemen.,Khost
688,Members of a violent Central American street gang have been sent to the southwestern U.S. state of Arizona to attack Minuteman Project volunteers as they begin a month-long campaign to help patrol the southern U.S. border with Mexico.,"U.S., Arizona, Minuteman Project, U.S., Mexico"
689,James Gilchrist a Minuteman organizer frustrated by the U.S. government's failure to control illegal immigration tells the Washington Times newspaper that leaders of Mara Salvatrucha or MS-13 have sent gang members to confront his group in Arizona.,"James Gilchrist, Minuteman, U.S., Washington Times, Mara Salvatrucha, MS-13, Arizona"
691,Likewise Hispanics from the National Alliance for Human Rights are going to Tombstone to protest the Minuteman Project.,"National Alliance for Human Rights, Minuteman Project"
692,"Last year 5,00,000 illegal aliens were caught in Arizona.",Arizona
693,MS-13 runs a major smuggling operation on the U.S.-Mexico border running drugs weapons and undocumented aliens from Central and South America into the United States.,"MS-13, Central and South America, United States"
694,The World Bank has approved $257 million in loans for business development in Colombia and a project designed to improve the country's environment.,"World Bank, Colombia"
695,In a statement issued Thursday the bank says its board of directors allocated $250 million to fund a business productivity and efficiency project designed to create businesses improve their access to financing and increase overall productivity in Colombia.,Colombia
696,The Bank allocated another $7 million to Colombia for a sustainable development project aimed at reducing air and water pollution improve hygiene and urban environmental management.,"Bank, Colombia"
697,The bank is also loaning El Salvador $27 million to support a poverty reduction program known as Red Solidaria designed to help the poorest Salvadorans by improving health nutrition and education in the country.,"El Salvador, Red Solidaria"
698,Italian opposition politicians are demanding Prime Minister Silvio Berlusconi apologize for using an obscenity to refer to anyone who would vote against him in Sunday's election.,"Prime, Silvio Berlusconi"
699,During a speech to a group of shopkeepers Tuesday Mr. Berlusconi used a word regarded by many as an obscenity and by others as an insult.,Mr. Berlusconi
701,The remark came a day after Mr. Berlusconi traded insults in a political debate with his chief political rival center-left leader Romano Prodi.,"Mr. Berlusconi, Romano Prodi"
702,"Both candidates assailed the other's fiscal policies with Mr. Berlusconi calling Prodi a"" useful idiot"" and Prodi saying the prime minister is like a"" drunkard clinging to a lamppost.""","Mr. Berlusconi, Prodi, Prodi"
705,Iraqi police say a roadside bombing in Baghdad Saturday killed at least two people who were taking part in a Shi'ite Muslim religious procession.,"Baghdad, Shi'ite Muslim"
706,The attack in the New Baghdad district also wounded eight others.,New Baghdad
707,Iraqi authorities have boosted security measures as hundreds of thousands of Shi'ite pilgrims flock to Iraq's holy shrine city of Karbala for the solemn Ashura holiday.,"Shi'ite, Iraq, Karbala"
