id,Sentence,Entities
216,In Beijing police are out in force waiting for protests to begin in the capital.,Beijing
217,State Councilor Tang Jiaxuan told the official Xinhua news agency that China's government is urging people to protest in a calm and orderly manner.,"State Councilor Tang Jiaxuan, Xinhua"
218,Japan's Foreign Minister Nobutaka Machimura arrives Sunday in Beijing for talks with his Chinese counterpart Li Zhaoxing to discuss relations between the two countries.,"Japan, Foreign Minister, Nobutaka Machimura, Beijing, Li Zhaoxing"
219,"Organizers of the 2012 Summer Olympics in London have promised the"" greenest games"" in history and sought to soothe concerns about the rising cost of the event.",London
221,The Olympic Delivery Authority has promised to cut emissions 50 percent by generating energy on site and using renewable energy.,Olympic Delivery Authority
222,Prime Minister Tony Blair said London is farther ahead in preparations at this stage than any other previous Olympic host city.,Prime Minister Tony Blair
225,China's giant pandas have been on endangered species lists for nearly 30 years.,China
226,"There are only about 1,600 pandas still living in the wild in China.",China
229,Sam Beattie reports from Jing Jing's home in Sichuan province.,"Sam Beattie, Sichuan"
230,British defense officials say 14 British military personnel have been killed in a crash of a NATO aircraft in southern Afghanistan.,"NATO, Afghanistan"
231,A NATO spokesman says the aircraft went off the radar and crashed in an open area near Kandahar Saturday.,"NATO, Kandahar"
232,Officials say the aircraft was supporting a NATO mission in the country's south but there is no indication of enemy action causing the crash.,NATO
233,The crash comes as NATO forces launched an offensive to drive Taleban remnants out of Kandahar.,"NATO, Taleban, Kandahar"
234,"Officials say"" Operation Medusa"" is aimed at removing the Taleban threat so that stability reconstruction and development can be achieved in the area.",Taleban
235,Sri Lankan authorities say a prominent Tamil journalist was found shot dead Friday in Colombo hours after he was abducted by several attackers as he left a restaurant.,"Sri, Tamil, Colombo"
236,Dharmeratnam Sivaram was a board member of the pro-rebel TamilNet Web site and a columnist for Sri Lanka's english newspaper the Daily Mirror.,"Dharmeratnam Sivaram, TamilNet"
237,Mr. Sivaram's Web site became popular for ongoing reports on the Sri Lankan civil war and was a prominent supporter of the Tamil Tiger rebel movement.,"Mr. Sivaram, Sri, Lankan, Tamil Tiger"
238,Mr. Sivaram who was also brutally attacked in 2001 was found near a lake gagged with gunshot wounds to the head.,Mr. Sivaram
241,Japanese media reported Monday that the two countries hope to arrange to hold the talks in Beijing in early November.,Beijing
245,A human rights group has accused coalition forces in Iraq of failing to secure evidence considered vital to the upcoming war crimes trial of former Iraqi leader Saddam Hussein.,"Iraq, Saddam Hussein"
246,Human Rights Watch in a report released Thursday said coalition forces failed to stop people from stealing thousands of Iraqi government documents in the months after the 2003 invasion of Iraq.,"Human Rights Watch, Iraq"
248,The Associated Press quotes a U.S. Defense Department spokeswoman as saying it has not reviewed the report.,"Associated Press, Defense Department"
249,Saddam Hussein was arraigned in July at a U.S. military base on the outskirts of Baghdad.,"Saddam Hussein, Baghdad"
251,Egypt's government and the World Health Organization say three Egyptian children have been hospitalized with the deadly form of avian flu.,World Health Organization
253,WHO says they are receiving treatment and are in stable condition.,WHO
257,Egypt has had the largest number of human bird flu cases outside of Asia.,"Egypt, Asia"
258,The head of the U.N. investigation into the Iraq oil-for-food program says Saddam Hussein illegally obtained more money from oil smuggling than from corruption in the U.N. program.,"U.N., Saddam Hussein, U.N."
259,Former U.S. Federal Reserve Chairman Paul Volcker says the smuggling began before the start of the oil-for-food program and was known to the United Nations Security Council.,"Federal Reserve, Chairman Paul Volcker, United Nations Security Council"
260,In an interview with the U.S. government-funded alHurra television station Mr. Volcker said there is a lot of confusion about how much money Saddam obtained from the oil-for-food program itself.,"government-funded, Mr. Volcker, Saddam"
262,The United Nations created the oil-for-food program after the first Gulf War to allow Iraq to sell oil and use the profits for the Iraqi people's humanitarian needs.,United Nations
263,Kyrgyzstan's Justice Ministry says four people including parliament member Tynychbek Akmatbayev have been killed at a prison near Bishkek after inmates took them hostage.,"Justice Ministry, Tynychbek Akmatbayev, Bishkek"
264,Interior Minister Murat Sutalinov is at the prison to head negotiations with the inmates.,Interior Minister Murat Sutalinov
267,Mr. Akmatbayev was involved in negotiations on Wednesday at another Kyrgyz prison where a riot over poor living conditions forced the staff to evacuate earlier this week.,Mr. Akmatbayev
268,That prison also near Bishkek remained surrounded by security forces on Thursday.,Bishkek
269,A commercial airplane taking off from Western Europe has landed in Iraq for the first time in nearly 20 years.,"Western Europe, Iraq"
270,The plane operated by France's Aigle Azur airline took off from Charles De Gaulle airport in Paris late Saturday and touched down at Baghdad International Airport early Sunday.,"Aigle Azur, Paris"
272,One of the passengers French Foreign Trade Minister Anne-Marie Idrac called it a historic day for cooperation between France and Iraq.,Foreign Trade Minister Anne-Marie Idrac
273,Regular service between Paris and Baghdad is not expected to start for at least several weeks.,"Paris, Baghdad"
274,Aigle Azur is just one of a number of airlines to start flying to Baghdad.,"Aigle Azur, Baghdad"
275,Etihad and Emirates airlines both operating out of the United Arab Emirates started flying to Baghdad earlier this year.,"Etihad, Emirates airlines, United Arab Emirates, Baghdad"
277,The Labor Department Friday issued a report that also showed the U.S. unemployment rate increased for the first time in three months - to 4.6 percent.,Labor Department
279,Analysts say the Department of Labor report will help ease worries that a tight labor market will significantly inflate wages and costs.,Department of Labor
281,Venezuelan President Hugo Chavez has denounced Colombia's defense minister as an obstacle to peace and a pawn of the United States.,President Hugo Chavez
282,Mr. Chavez reacted sharply Sunday to the defense minister's remarks about a meeting between Mr. Chavez and Colombian President Alvaro Uribe.,"Mr. Chavez, Mr. Chavez, President Alvaro Uribe"
284,After the meeting Colombian Defense Minister Juan Manuel Santos said he hoped Venezuela would follow through with promises made during the meeting.,Defense Minister Juan Manuel Santos
285,During a televised speech Sunday Mr. Chavez called on President Uribe to put his defense minister in his place.,"Mr. Chavez, President Uribe"
286,Tensions between the two countries rose in March when Colombia attacked a rebel camp in Ecuador.,Ecuador
289,In its annual report issued Wednesday the U.S. Commission on International Religious Freedom said China continues to be responsible for pervasive and severe violations of religious freedom regularly imprisoning and harassing religious leaders and practitioners.,U.S. Commission on International Religious Freedom
290,In a statement Saturday Chinese Foreign Ministry spokesman Liu Jianchao accused the U.S. body of attempting to interfere with Chinese internal affairs under the guise of religious freedom.,"Foreign Ministry, Liu Jianchao"
292,Liu said China protects the religious freedom of Chinese citizens according to law and that citizens enjoy full freedom of religion.,Liu
295,President Bush has issued 14 pardons to convicted criminals and has commuted the prison sentences of two others.,President Bush
298,Including Monday's actions Mr. Bush has granted 171 pardons and commuted eight sentences while U.S. president.,Mr. Bush
300,White House officials say he made the pardon decisions on a case-by-case basis and will continue to review clemency requests.,White House
301,Uganda's government and rebels of the Lord's Resistance Army are nearing a peace deal to end more than 20 years of conflict.,Lord 's Resistance Army
302,Officials close to the negotiations say an accord signed Friday provides for the disarmament and demobilization of the LRA.,LRA
303,The two sides signed a permanent cease-fire agreement last Saturday during peace talks in Sudan.,Sudan
304,However there is still uncertainty the rebels will sign the final peace deal until rebel leader Joseph Kony is granted immunity from international prosecution.,Joseph Kony
305,Kony is one of five LRA officials sought by the International Criminal Court for alleged war crimes.,"Kony, LRA, International Criminal Court"
306,LRA fighters are accused of murdering thousands of civilians and raping and mutilating others during the long insurgency in northern Uganda.,"LRA, Uganda"
307,World number one men's tennis player Roger Federer has been nearly unbeatable in the past year.,Roger Federer
309,The Swiss star was upset Wednesday by German Tommy Haas in the opening match of the Kooyong Classic in Melbourne.,"Tommy Haas, Melbourne"
311,The 41st ranked Haas fended off three break points while serving for the match and closed a 03-Jun 06-Apr 06-Apr win with an ace.,Haas
312,Federer said he is completely healthy and has no concerns that the ankle problem that curtailed his last season would flare up before the Australian Open which starts Monday.,Federer
313,The European Space Agency says it has received the first images and scientific readings from the surface of Saturn's moon Titan.,"European Space Agency, Saturn, Titan"
314,Officials at agency headquarters in Germany Friday say information taken from the Huygens space probe show what looks like drainage channels on the moon.,Germany
316,The space probe began transmitting data to the Cassini spacecraft while landing on Saturn's largest moon earlier Friday.,Saturn
317,Scientists say the information from Huygens - operated jointly by the American European and Italian space agencies - may provide clues about how primitive Earth evolved into a life-bearing planet.,"European, Earth"
318,Ugandan opposition leader Kizza Besigye has been released on bail after a judge ruled his detention by the military was illegal.,Kizza Besigye
319,Police fired tear gas to disperse hundreds of Dr. Besigye's supporters who took to the streets in Kampala after his release Monday.,"Dr. Besigye, Kampala"
320,Uganda's military had detained Dr. Besigye since November when he returned from self-imposed exile to run against President Yoweri Museveni in next month's presidential election.,"Dr. Besigye, President Yoweri Museveni"
321,A military tribunal has charged Dr. Besigye with terrorism and possessing illegal weapons.,Dr. Besigye
322,But a Ugandan High Court Judge John Bosco Katutsi said his detention was illegal because the High Court had suspended the military trial.,"High Court, John Bosco Katutsi, High Court"
323,Dr. Besigye still faces rape charges for which a civilian trial began Monday.,Dr. Besigye
325,U.S. President Barack Obama says improvements in the American health care system are inevitable.,President Barack Obama
326,Mr. Obama made his comments in the White House Rose Garden Monday as he nominated an African-American woman Regina Benjamin to become the U.S. Surgeon General.,"Mr. Obama, Regina Benjamin, Surgeon General"
329,Mr. Obama has vowed to sign a health care bill into law this year.,Mr. Obama
330,Democrats in the House of Representatives say they are nearly ready to unveil their health care reform plan.,"Democrats, House of Representatives"
333,World Bank member nations meeting in Washington have approved a debt relief plan for 17 African and Latin American countries that could total $37 billion over 40 years.,"World Bank, Washington"
334,World Bank President Paul Wolfowitz said two-thirds of the bank members have now approved the plan meaning the bank could start forgiving debts in July.,"World Bank, President Paul Wolfowitz"
335,The move follows July's pledge from the wealthy G-8 countries to cancel the debt of the world's poorest countries many of which are located in Africa.,"G-8, Africa"
336,The 17 countries now eligible for World Bank debt relief are Benin Bolivia Burkina Faso Ethiopia Ghana Guyana Honduras Madagascar Mali Mozambique Nicaragua Niger Rwanda Senegal Tanzania Uganda and Zambia.,World Bank
337,Iran has closed government offices and schools in Tehran for two days because of wind-blown dust that has polluted the capital.,Tehran
340,Iran's Press TV says Tehran's Air Quality Control Company has found the amount of potentially harmful particulate in the air has reached dangerous levels.,"Press TV, Tehran, Air Quality Control Company"
341,The dust has blown in from Saudi Arabia and neighboring Iraq where a severe sandstorm recently blanketed the capital Baghdad.,"Saudi Arabia, Iraq, Baghdad"
343,Shortly before midnight a suicide bomber blew himself up in a crowd of young Israelis waiting to get into a beachfront nightclub in Tel Aviv.,Tel Aviv
347,A statement released by Palestinian President Mahmoud Abbas in Ramallah vowed to track down and punish those responsible saying this was an attempt to sabotage the peace process.,"President Mahmoud Abbas, Ramallah"
348,The bombing shatters weeks of calm after Mr. Abbas declared a truce during a summit with Israeli Prime Minister Ariel Sharon in Egypt earlier this month.,"Mr. Abbas, Prime Minister Ariel Sharon, Egypt"
349,Indonesian officials say they have signed an initial agreement with Russia to build a space launch center on the remote island of Biak off the coast of Papua New Guinea.,"Biak, Papua New Guinea"
351,They say the island is well-suited for the project because of its proximity to the equator which makes it easier to launch satellites into some Earth orbits.,Earth
352,The spokesman says a formal agreement on the project will be signed in June when Indonesian President Susilo Bambang Yudhoyono is scheduled to visit Moscow.,"President Susilo Bambang Yudhoyono, Moscow"
353,An Algerian man goes on trial Monday in France for terrorist attacks on the Paris subway in 1995.,"France, Paris"
354,Prosecutors say Rachid Ramda helped fund at least three bombings on the Paris metro.,"Rachid Ramda, Paris"
355,If he is convicted Ramda could get life in prison.,Ramda
356,The 38-year-old is already serving a 10-year sentence in France after he was convicted last year on terrorism charges.,France
357,Police say Ramda operated from London where investigators say they found evidence that he sent money to terrorists.,"Ramda, London"
358,He is accused of helping fund attacks carried out by an Algerian militant organization the Armed Islamic Group.,Armed Islamic Group
359,British police arrested Ramda in 1995.,Ramda
360,He fought extradition to France for 10 years.,France
361,In Monday's trial Ramda is facing charges of being an accomplice to at least three bombings on the Paris subway including the July 25 1995 attack that killed eight people and injured more than 150.,"Ramda, Paris"
362,The United Nations says Sudanese refugees have begun returning from the Central African Republic under a new deal between the countries and the U.N. refugee agency.,"United Nations, U.N."
363,"The U.N. says the deal which was signed Wednesday will allow some 16,000 Sudanese refugees living in the CAR to voluntarily return home.",U.N.
368,"The U.N. says the other agreements will allow for the return of 13,000 Sudanese refugees living in the Democratic Republic of Congo and for the return of nearly 7,000 Congolese refugees currently in Sudan.",U.N.
369,Police in Japan say a teacher stabbed to death a 12-year-old girl Saturday in the country's third killing of a school girl in less than three weeks.,Japan
370,Yu Hagino 23 was arrested at the murder scene a school in the western city of Uji.,"Yu Hagino, Uji"
374,Radical Islamic cleric Omar Bakri Mohammed has called on all Muslims to leave Europe.,"Omar Bakri Mohammed, Europe"
375,In an interview with French television to be broadcast Monday Mr. Bakri says Muslims will one day return to Europe and the Islamic flag will fly over Downing Street the home of Britain's prime minister.,"Mr. Bakri, Muslims, Europe"
376,The interview took place in Beirut where Mr. Bakri lives after the British government stripped him of his residency in its campaign to rein in radical Islamic leaders.,"Beirut, Mr. Bakri"
377,Mr. Bakri triggered British outrage after the July 7 bombings in London when he said he would never tip off police if he knew a Muslim was about to carry out an attack.,"Mr. Bakri, London, Muslim"
378,In the France 3 interview Mr. Bakri says the backgrounds of the four suicide bombers in the London attacks prove the message of al-Qaida chief Osama bin Laden has reached moderate communities.,"Mr. Bakri, London, al-Qaida, Osama bin Laden"
380,Joint Chiefs of Staff Chairman Mike Mullen said Sunday that the U.S. has a plan to strike Iran.,"Joint Chiefs of Staff, Mike Mullen"
381,But Admiral Mullen said he hopes the military option is not needed.,Admiral Mullen
382,Iran's defense minister Brigadier General Ahmad Vahidi said Tuesday that U.S. threats to attack his country violate the United Nations charter.,"Brigadier General Ahmad Vahidi, United Nations"
385,Admiral Mullen said he hopes the combination of sanctions and diplomatic efforts will resolve the dispute.,Admiral Mullen
386,Georgia's president has announced plans for his country to get emergency natural gas supplies from Iran to help end the country's shortage of both gas and electricity.,Iran
387,President Mikhail Saakashvili told cabinet members Friday that gas from Iran is expected to begin flowing into Georgia beginning Sunday or at the latest Monday.,"President Mikhail Saakashvili, Iran, Georgia"
392,President Saakashvili says the agreement with Iran shows his country has alternative sources.,"President Saakashvili, Iran"
394,Peru's former President Alberto Fujimori has told authorities he is trying to form a political alliance to support his bid to run in next April's presidential election.,Alberto Fujimori
395,In a visit to the Peruvian consulate in Tokyo Wednesday Mr. Fujimori had his signature validated on a document joining his Si Cumple party with two other political parties.,"Tokyo, Mr. Fujimori, Si Cumple"
397,The disgraced ex-president and son of Japanese parents fled to Japan in 2000 where he was granted citizenship.,Japan
398,The exiled president is wanted in Peru to face charges of corruption and human rights abuses related to the death squad murders of 25 people.,Peru
399,Mr. Fujimori Peru's hard-line ruler from 1990 to 2000 has denied the charges calling them politically motivated.,"Mr. Fujimori, Peru"
401,The British Embassy in Sudan's capital has re-opened to the public four days after it was closed because of a possible terrorist threat.,Sudan
404,Earlier this week the government said it had broken up a plot to attack several Western diplomatic missions in the capital Khartoum.,Khartoum
406,The British Embassy has advised British citizens to avoid travel to Khartoum.,Khartoum
407,Kenyan police have opened fire at hundreds of people demonstrating against cartoons depicting the Prophet Muhammad as protests across the Muslim world showed no signs of abating.,"Prophet Muhammad, Muslim"
408,At least one Kenyan was wounded Friday when protesters tried to march on the Danish embassy in Nairobi shouting anti-Denmark slogans and burning Danish flags.,Nairobi
409,Muslims also demonstrated Friday in cities across the Middle East as well as in India Pakistan Afghanistan Bangladesh Malaysia and Venezuela.,"Middle East, India, Pakistan, Afghanistan, Bangladesh, Malaysia, Venezuela"
410,In France a Muslim organization - the French Council of the Muslim Faith - said it was launching legal action against French newspapers that published the cartoons one of which depicts the Prophet Muhammad wearing a turban shaped like a bomb.,"France, Muslim, Council, Muslim Faith, Prophet Muhammad"
411,"Malaysian Prime Minister Abdullah Ahmad Badawi told an international conference Friday the Muslim world and the West must stop demonizing each other and"" accept one another as equals.""","Prime Minister Abdullah Ahmad Badawi, Muslim, West"
412,The death toll from a coal mining accident in northwestern China rose to 32 Wednesday after searchers recovered the body of the last missing miner.,China
413,China's state-run media say 39 people were working at the privately-owned coal mine in Shaanxi province on Saturday when a gas explosion occurred.,"China, Shaanxi"
415,The Xinhua news agency says police have detained the owner and managers of the mine but provided no other details.,Xinhua
418,India and Pakistan plan to hold a third round of peace talks in January with a focus on security the Kashmir issue and confidence-building measures between the nuclear rivals.,"India and Pakistan, Kashmir"
422,A foreign office spokeswoman in Islamabad also said that the two sides have been holding secret talks on possible reduction of forces in Kashmir and a Pakistani proposal of self-rule in Kashmir.,"Islamabad, Kashmir, Kashmir"
424,India has not made any comment about the talks.,India
425,Iraqi officials say at least two people were killed and several others wounded in a car bomb blast in central Baghdad Tuesday.,Baghdad
428,On Monday dozens of people were killed and scores were hurt in a series of car bombings and other attacks in cities and towns across Iraq.,Iraq
429,Also Monday an al-Qaida-linked group claimed responsibility for gunning down a top Iraqi security official (Wael al-Rubaei) and his driver in Baghdad.,"Wael al-Rubaei, Baghdad"
430,Iran's hard-line Guardian Council has approved a bill that would block United Nations inspections of its nuclear facilities and allow it to resume uranium enrichment if it is referred to the U.N. Security Council.,"Iran, Guardian Council, United Nations, U.N. Security Council"
433,The final step will be President Mahmoud Ahmadinejad's signature.,President Mahmoud Ahmadinejad
437,Zambian officials say reports that President Levy Mwanawasa has died are FALSE.,President Levy Mwanawasa
438,Information Minister Mike Mulongoti made a televised address Thursday to say the foreign media reports are not TRUE.,Information Minister Mike Mulongoti
439,He said President Mwanawasa remains in stable condition in a Paris hospital and is being treated for hypertension.,"President Mwanawasa, Paris"
440,Mr. Mwanawasa was flown to France Tuesday after suffering a stroke Sunday while in Egypt for an African Union summit.,"Mr. Mwanawasa, France, Egypt, African Union"
441,The summit was dominated by the political crisis in Zimbabwe and the absence of Mr. Mwanawasa a critic of Zimbabwean President Robert Mugabe was said to hurt attempts to put more pressure on Harare.,"Zimbabwe, Mr. Mwanawasa, President Robert Mugabe"
442,Mr. Mwanawasa is 59 years old and has served as Zambia's president since 2002.,Mr. Mwanawasa
443,He is also the current leader of the Southern African Development Community.,Southern African Development Community
445,U.S. President Barack Obama has named Gene Sperling as the new head of the National Economic Council which oversees the administration's economic policies.,"President Barack Obama, Gene Sperling, National Economic Council"
446,Sperling had the same job in President Bill Clinton's administration.,"Sperling, President Bill Clinton"
447,He succeeds Lawrence Summers another top economic official from the Clinton-era.,Lawrence Summers
448,Sperling has spent the first two years of the Obama administration as a counselor to Treasury Secretary Timothy Geithner.,"Sperling, Obama, Treasury Secretary Timothy Geithner"
449,Mr. Obama made the announcement Friday during a visit to a window manufacturer located outside of Washington D.C.,"Mr. Obama, Washington, D.C."
450,Sperling's appointment is the latest major staff change for the Obama administration as it begins dealing with a new Republican majority in the House of Representatives and planning for the president's likely re-election campaign in 2012.,"Sperling, Obama, House of Representatives"
451,On Thursday Mr. Obama named another ex-Clinton official William Daley as his new chief of staff replacing Rahm Emmanuel.,"Mr. Obama, William Daley, Rahm Emmanuel"
452,Authorities in Bosnia-Herzegovina say they have arrested a former Bosnian Serb police officer for his suspected role in the 1995 massacre of Muslims near the eastern Bosnian town of Srebrenica.,Srebrenica
453,The state prosecutor's office says 37-year-old Dragan Neskovic was arrested Wednesday in the northeastern town of Bijeljina on suspicion of genocide.,"Dragan Neskovic, Bijeljina"
455,"More than 8,000 Muslim men and boys were killed by Serb forces in July 1995 in what was supposed to have been a United Nations safe haven.",United Nations
456,The Srebrenica killings are considered the worst European massacre since World War II.,Srebrenica
457,The U.N. war crimes tribunal in The Hague has already sentenced 14 Serbs for their key roles in the killings.,"U.N., Hague"
458,Former Bosnian Serb leader Radovan Karadzic is currently on trial there charged with genocide and crimes against humanity.,Radovan Karadzic
