id,Sentence,Entities
1,Latte al seno sos di Pedrotti,Pedrotti
5,A parlare di questi problemi sarà il neonatologo Dino Pedrotti.,Dino Pedrotti
6,«Se io fossi un neonato - scrive Dino Pedrotti - vorrei trovare un mondo che mi accoglie bene e mi aiuta a realizzarmi.,Dino Pedrotti
11,sarà presente l'assessore Andreolli».,Andreolli
17,Per aiutare le mamme in difficoltà gli Amici della Neonatologia Trentina hanno edito un opuscolo con tanti consigli aggiornati «L'ABC dell'Allattamento materno» distribuito in occasione dell'incontro.,Amici della Neonatologia Trentina
19,Università Cipolletta pronto a restare,"Università, Cipolletta"
20,Cambia il consiglio di amministrazione,consiglio di amministrazione
23,Di ANDREA TOMASI,ANDREA TOMASI
25,Innocenzo Cipolletta potrebbe rimanere sulla poltrona di presidente del consiglio di amministrazione dell'Università.,"Innocenzo Cipolletta, consiglio di amministrazione, Università"
27,Stimato dal presidente della giunta provinciale Lorenzo Dellai in ottimi rapporti con il rettore uscente Massimo Egidi pare essere apprezzato da buona parte del mondo accademico locale.,"giunta provinciale, Lorenzo Dellai, Massimo Egidi"
28,Gli sviluppi si conosceranno nei prossimi giorni visto che il cda è giunto alla sua scadenza naturale e le candidature al nuovo consiglio dovranno essere formalizzate entro martedì per poi arrivare all'elezione dei docenti il 27 del mese.,"cda, consiglio"
29,Quando in seguito verranno definite tutte le componenti con i rappresentanti del personale e delle varie categorie esterne all'accademia sarà il nuovo cda ad eleggere il presidente individuato fra i «membri laici».,cda
30,All'interno dell'ateneo c'è chi pensa che Cipolletta possa essere la persona giusta per quella carica vista la sua storia e i forti legami con il mondo dell'industria italiana.,Cipolletta
31,62 anni una laurea in Scienze statistiche all'Università di Roma è stato recentemente nominato alla presidenza del «Gruppo Sole24Ore».,"Università di Roma, Gruppo Sole24Ore"
32,Un impegno che - dice - non gli impedirà di continuare a guidare le sedute del cda dell'ateneo trentino.,cda
35,Ieri era a Rovereto dove è stata inaugurata la Facoltà di Scienze cognitive.,Facoltà di Scienze cognitive
40,«L'Università ha le sue competenze.,Università
48,L'Università avrà un nuovo rettore e la possibilità di programmare gli investimenti.,Università
50,Poi non si deve sottovalutare l'evoluzione della Facoltà di Scienze cognitive che ha grossi potenziali».,Facoltà di Scienze cognitive
57,Collio farà i 100 Longo gli 800 e la Martinez il triplo.,"Collio, Longo, Martinez"
58,Fra i regionali Berlanda e Niederstätter,"Berlanda, Niederstätter"
60,Devonish la Bailey e tutti i protagonisti gara per gara,"Devonish, Bailey"
61,"UOMINI - 100 METRI / Quest'anno l'inglese Marlon Devonish oro olimpico con la 4x100 ha un record di 10"" 32 ma il personale è 10"" 13 (del'98).",Marlon Devonish
62,"Il favorito è lo statunitense Joshua Johnson (10"" 11 ma nel 2002 addirittura 9"" 95).",Joshua Johnson
63,"In agguato Simone Collio (10"" 20) lo sloveno Osovnikar (10"" 15) e lo statunitense Streete - Thompson (10"" 15).","Simone Collio, Osovnikar, Streete - Thompson"
64,"Nella serie B occhio a Torrieri (10"" 32) e Kaba Fantoni (10"" 28).","serie B, Torrieri, Kaba Fantoni"
65,"400 METRI / Il giamaicano Blackwood è un finalista olimpico (8° personale di 44"" 60).",Blackwood
66,"Il keniano Sambu è un bel tipino (45"" 33).",Sambu
67,"Andrea Barberi (45"" 98) è il migliore dei nostri.",Andrea Barberi
68,"800 METRI / Il semifinalista olimpico Andrea Longo (1'44"" 42 stagionale 1'43"" 74 nel 2000) contro tutti;",Andrea Longo
69,"anche contro il record italiano di Fiasconaro (1'43"" 7 nel'73).",Fiasconaro
70,"Il belga Som fa paura (1'44"" 37) ma non scherzano neppure i keniani Wachira (1'45"" 13) e Yego (argento ai Mondiali junior) e il sudanese Ismail (1'45"" 17).","Som, Wachira, Yego, Ismail"
71,"Nella serie B gli altoatesini Neunhauserer (1'46"" 07 nel 2002) e Rifesser (18 anni 1'51"" 18).","serie B, Neunhauserer, Rifesser"
72,"5.000 METRI / Anche il trentino Massimo Pegoretti (13'35"" 64) contro l'eritreo Tadesse (7° ad Atene 13'05"" 57) e i keniani Joseph Kosgei (13'11"" 32) David Kilel (13'11"" 83) e Daniel Komen (13'21"" 45 ma 12'39"" 74 nel'97 record del mondo fino al 12'39"" 36 di Gebrselassie).","Massimo Pegoretti, Tadesse, Joseph Kosgei, David Kilel, Daniel Komen, Gebrselassie"
73,"400 OSTACOLI / Il panamense Kamani è uno spettacolo (48"" 23 5° ad Atene e 1° al meeting di Bruxelles).",Kamani
74,"L'altoatesino Crepaz (50"" 68) ci proverà.",Crepaz
75,"5.000 MARCIA / Passerella per Ivano Brugnetti oro di Atene nella «20» che su questa distanza ha un personale di 19'43"" 24 (2003).",Ivano Brugnetti
77,PESO / L'arrabbiato «non olimpico» Dal Soglio (20.19) contro il bielorusso Belov (21.14 6° ad Atene).,"Dal Soglio, Belov"
79,Vasilevskis (84.95) è l'argento olimpico e l'altro è Lusis (82.76).,"Vasilevskis, Lusis"
80,ALTO / Lo statunitense Nieto (2.34 4° ad Atene) contro lo svedese Strand (2.30) e i gemelli Nicola (2.30) e Giulio Ciotti (2.26).,"Nieto, Strand, Nicola, Giulio Ciotti"
81,TRIPLO / Lister (17.78 2° al mondo nel 2004) è il vincitore dei Trial americani ma alle Olimpiadi ha deluso come ha deluso il nostro Donato (16.91).,"Lister, Donato"
82,Attenti all'altro statunitense Kenta Bell (17.58).,Kenta Bell
83,"DONNE - 200 METRI / La giamaicana Bailey (22"" 33) ha vinto l'oro olimpico con la 4x100.",Bailey
84,"Nella serie B c'è la roveretana Doris Tomasini (24"" 12 4ª agli Italiani).","serie B, Doris Tomasini"
85,"800 METRI / La slovena Ceplak (1'55"" 19) ha intascato il bronzo olimpico ed è la campionessa europea in carica.",Ceplak
86,"Vediamo se la Artuso (2'01"" 04) avvicina i 2 minuti netti.",Artuso
87,"1.500 METRI / L'ucraina Sidorenko (4'04"" 78) e la keniana Lagat (4'05"" 32) faranno l'esame alle trentine Berlanda (4'12"" 80 campionessa italiana) e Dal Ri (4'23"" 84) e alle altoatesine Weissteiner (4'16"" 6 manuale) e Tschurtschenthaler (4'20"" 65).","Sidorenko, Lagat, Berlanda, Dal Ri, Weissteiner, Tschurtschenthaler"
88,"400 OSTACOLI / La 6ª (Bikert russa 53"" 72) e la 7ª di Atene (Taylor statunitense 53"" 36) più l'argento mondiale 2003 (Glover statunitense 53"" 33) contro l'altoatesina Niederstätter (55"" 52 primatista italiana dal'99 con 55"" 10).","Bikert, Taylor, Glover, Niederstätter"
89,GIAVELLOTTO / Braccio di ferro tra l'azzurra Coslovich (62.66) e la russa Zabruskova (63.84).,"Coslovich, Zabruskova"
90,ASTA / Rivincita olimpica fra la 3ª di Atene (la polacca Anna Rogowska 4.71) la 4ª (l'altra polacca Pirek 4.72) e la 5ª (l'islandese Elisdottir 4.60).,"Anna Rogowska, Pirek, Elisdottir"
91,Ma la russa Polnova (4.72) 2ª a Bruxelles può battere tutti.,Polnova
92,E c'è anche la trentina Bresciani (4.20 campionessa italiana).,Bresciani
94,l'azzurra Martinez (7ª 14.85 ma un personale di 15.03) l'algerina Rahouli (6ª 14.89) e la russa Pyatykh (8ª 14.85 anche lei).,"Martinez, Rahouli, Pyatykh"
95,Di contorno la 21enne Simona La Mantia (14.49).,Simona La Mantia
98,Ecco il nuovo elenco degli azionisti di Euregio Finance:,Euregio Finance
99,Alpenair Ifi Cooperativa Lavoratori Edili Ivo Defranceschi Treufinanz Aspiag Sicet Michele Salerno (tutte di Bolzano) Olot Bv (Amsterdam) Duka (Chiusa) Alps Finance (Lana) Compagnia Investimenti e Sviluppo (Verona) Adanti (Bologna) Nofra (Brunico) Livolsi & Partners (Milano) Eurobau Home (San Candido) Würth (Egna) Helmut Marsoner (Innsbruck) Studio Tecnico Italiano (Roma) e Unionbau (Campo Tures).,"Alpenair, Ifi, Cooperativa Lavoratori Edili, Ivo Defranceschi, Treufinanz, Aspiag, Sicet, Michele Salerno, Olot Bv, Duka, Alps Finance, Compagnia Investimenti e Sviluppo, Adanti, Nofra, Livolsi & Partners, Eurobau Home, Würth, Helmut Marsoner, Studio Tecnico Italiano, Unionbau"
100,Euregio Finance è nata per promuovere e realizzare iniziative di interesse locale regionale sovraregionale e internazionale con l'obiettivo di favorire lo sviluppo economico del territorio.,Euregio Finance
101,È stata costituita il 3 ottobre 2003 da Alpenair e dalla finanziaria olandese Olot Bv.,"Alpenair, Olot Bv"
102,Il cda è composto da Franz Senfter Franz Staffler Gilberto Gabrielli dai Consiglieri Johann Krapf Mauro Miccio e Rudolf Alois Rimbl.,"Franz Senfter, Franz Staffler, Gilberto Gabrielli, Johann Krapf, Mauro Miccio, Rudolf Alois Rimbl"
104,La buona verve di Wall Street non è riuscita a dare l'intonazione giusta a Piazza Affari che archivia la giornata di contrattazioni in calo.,"Wall Street, Piazza Affari"
108,Giornata di vendite per gli istituti di credito a Piazza Affari che hanno pesato su tutto il listino.,Piazza Affari
109,"Banca Intesa ha ceduto l'1,83% e la Popolare di Verona e Novara lo 0,5%.","Banca Intesa, Popolare di Verona e Novara"
110,"Debole anche Capitalia in flessione dell'1,65% così come Bnl (- 1,68%) mentre si è mossa in controtendenza Mps (+ 0,28%).","Capitalia, Bnl, Mps"
111,"Giù anche Antoveneta (- 1,67%) perdita più contenuta per Unicredito (- 0,25%).","Antoveneta, Unicredito"
114,"Ancora nervosismo per i titoli Alitalia che ha chiuso invariata (- 0,04%) dopo aver oscillato tra un calo del 2,7% e un rialzo del 2,25%.",Alitalia
115,"Seduta positiva invece per Fiat con un progresso dello 0,67% a 6,191 euro.",Fiat
117,"Limate le Enel (- 0,02%) deciso calo per Saipem (- 2,67%).",Saipem
118,"Fra i titoli delle telecomunicazioni Tim ha chiuso la seduta con una flessione dello 0,45%.",Tim
120,"Fra i media ha chiuso in calo dello 0,65% Mediaset.",Mediaset
121,"Sul Nuovo Mercato vendite per e.Biscom (- 1,67%) Euphon (- 1,11%) e anche Inferentia in calo del 2,02%.","e.Biscom, Euphon, Inferentia"
122,Chiusura invariata per Tiscali.,Tiscali
124,E'il benvenuto da parte della guerriglia alla Brigata Friuli appena arrivata in Iraq,Brigata Friuli
129,il benvenuto alla Brigata aeromobile Friuli appena arrivata in Iraq.,Brigata aeromobile Friuli
132,I soldati della Brigata Friuli hanno immediatamente risposto al fuoco e subito dopo visto che la sparatoria continuava sono state fatte intervenire due aliquote della Forza di reazione rapida con quattro blindo Centauro ed altri otto mezzi (6 cingolati Vcc e 2 Vm) protetti.,"Brigata Friuli, Forza di reazione rapida"
137,Il colonnello Carmelo Abisso non è sorpreso della «calda» accoglienza ricevuta dagli uomini della Friuli da parte della cosiddetta guerriglia.,"Carmelo Abisso, Friuli"
140,Religion Today c'è anche la Koll,Koll
141,Di KATIA MALATESTA,KATIA MALATESTA
143,"«Vogliamo promuovere la consapevolezza che le diversità esistenti"" sotto un unico cielo"" - titolo e ispirazione delle due edizioni precedenti - sono una ricchezza e un patrimonio irrinunciabile del genere umano» ha spiegato ieri in conferenza stampa don Massimo Manservigi presidente del Festival:",Massimo Manservigi
148,il teologo don Gabriele Nanni il regista iraniano Daryush Yari vincitore della seconda edizione del Festival il direttore del FilmFestival di Daka del Bangla Desh Ahmed Muztaba Zamal il produttore inglese Jery Kuhel e a sorpresa Claudia Koll.,"Gabriele Nanni, Daryush Yari, Ahmed Muztaba Zamal, Jery Kuhel, Claudia Koll"
149,«La sua presenza - spiega Lia G. Beltrami direttrice artistica del Festival - ci è molto gradita perché l'attrice potrà raccontare il percorso interiore che dopo il viaggio in Etiopia ha cambiato la sua vita e quella di tante persone».,Lia G. Beltrami
150,"Tra i 29 film in concorso con un'importante partecipazione del mondo cristiano ortodosso e del mondo islamico sciita e sunnita spicca la sezione dei film a soggetto che vanta la presenza di"" The Passion"" di Mel Gibson al suo primo festival;",Mel Gibson
151,"tra i documentari si segnala"" Non solo K2"" la prova del trentino Renato Morelli sulla vita del regista Marco Baldi che nel pomeriggio di venerdì 22 fuori concorso presenterà al Teatro Cuminetti il suo ultimo film"" La perla nascosta"" viaggio tra vicino e lontano Oriente alla scoperta della civiltà aramaica.","Renato Morelli, Marco Baldi"
153,"Al concorso inoltre si accompagnerà una riflessione sulla Passione di Gesù ispirata dal recente film di Gibson ma sollecitata soprattutto da una quotidianità percorsa dalla violenza."" La Passione e le passioni"" è il titolo del Seminario di studi organizzato in collaborazione con l'Itc - Istituto di Scienze Religiose in programma a Trento dal 20 al 22 ottobre.","Gibson, Itc, Istituto di Scienze Religiose"
155,"dalla mostra degli artisti dell'Ucai dedicata a"" Chiara d'Assisi.",Ucai
156,"Chiarore della luce perenne"" (al Centro Bernardo Clesio) all'esposizione di un fico in rame di Mastro 7.",Mastro 7
159,Religion Today - via Barbacovi 4 38100 Trento - Tel e Fax 0461 981853 (dal lunedì al giovedì 9.00 - 12.00) Sito Web:,via Barbacovi 4
161,Castelli farà De Gasperi,"Castelli, De Gasperi"
162,TRENTO - Sarà la voce di Andrea Castelli a narrare in uno sceneggiato radiofonico «Caro Alcide» (Edizioni Curcu & Genovese) il nuovo libro di Pino Loperfido la biografia romanzata di Alcide De Gasperi che ha incontrato sia i favori della critica che quella del pubblico.,"Andrea Castelli, Edizioni Curcu & Genovese, Pino Loperfido, Alcide De Gasperi"
163,Lo sceneggiato realizzato dalla Struttura Programmi della Sede Rai di Trento è strutturato su quattordici puntate della durata di quindici minuti circa che andranno in onda tutti i venerdì dalle 14.15 alle 14.30 a partire dal primo di ottobre fino alla fine di dicembre.,Rai
164,Oltre a Andrea Castelli il cast comprende altri importanti nomi della drammaturgia trentina.,Andrea Castelli
165,Alcide De Gasperi sarà interpretato da Carlo Marzani mentre i dialoghi maschili presenti nel libro saranno affidati a Bruno Vanzo e Mario Cagol.,"Alcide De Gasperi, Carlo Marzani, Bruno Vanzo, Mario Cagol"
166,Cecilia Ruele interpreterà suor Lucia De Gasperi nel toccante dialogo con suo padre.,"Cecilia Ruele, Lucia De Gasperi"
167,Infine i dialoghi tra le due ipotetiche abitanti di Sella Valsugana si avvarranno delle voci di Giovanna Rosso e Claudia Tomasini della filodrammatica di Olle Valsugana.,"Giovanna Rosso, Claudia Tomasini, filodrammatica"
168,La realizzazione tecnica è di Italo Salvador e la regia è di Maria Serena Tait.,"Italo Salvador, Maria Serena Tait"
171,Ljubojevic Beciri Jesenicnik Kelar Ljubijankic Vrsic Birsa.,"Ljubojevic, Beciri, Jesenicnik, Kelar, Ljubijankic, Vrsic, Birsa"
172,Berni Piccolo Zambelli Loviso Nocerino Pepe Corvia.,"Berni, Piccolo, Zambelli, Loviso, Nocerino, Pepe, Corvia"
173,Briakos (Grecia),Briakos
174,QUI ARCO / Il parere del capitano di lungo corso dopo uno lo 0 a 0 all'esordio,ARCO
177,di GIANLUCA DE MASI,GIANLUCA DE MASI
178,ARCO - Nell'esordio stagionale di domenica contro la matricola ferrarese nel quale l'Arco non è riuscito ad andare oltre ad un pareggio casalingo a reti inviolate si è fatta sentire e non poco l'assenza del capitano e del leader carismatico del gruppo Giulio Andreoli.,"Arco, Giulio Andreoli"
179,L'elemento cardine del gioco arcense (grandissima esperienza in D per aver giocato nella Benacense nel Rovereto nell'Arzignano nel Bassano e nel S. Donà) ha dovuto accomodarsi in panchina per un problema all'adduttore patito la settimana prima e che non gli consente di essere al 100%.,"D, Benacense, Rovereto, Arzignano, Bassano, S. Donà"
188,Non dimentichiamo la palla goal sui piedi di Toccoli (nella foto il centrale arcense sganciatosi domenica per fare gol a sorpresa trovando la parata di piede di Atti ndr) dove è stato bravo il loro portiere ad opporsi con i piedi e anche il goal annullato a Dal Ferro per un fuorigioco millimetrico.,"Toccoli, Atti, Dal Ferro"
193,Spero di tornare a disposizione del mister e sono fiducioso soprattutto alla luce del fatto che la prossima settimana potremo disporre di una condizione fisica di base migliore di quella contro la Reno Centese».,Reno Centese
194,La vertenza della sanità si complica anche in vista del rinnovo delle Rsu,Rsu
197,Sul rinnovo del contratto del comparto sanità interviene la Cisl funzione pubblica.,Cisl funzione pubblica
198,Dopo che Uil e Nursing up i due sindacati maggiormente rappresentativi hanno abbandonato il tavolo con l'Apran si profila l'ennesimo braccio di ferro tra professioni sanitarie e non sanitarie.,"Uil, Nursing up, Apran"
199,«Lo scontro tra le organizzazioni sindacali trentine sul rinnovo del contratto della sanità non ha precedenti né in Trentino né a livello nazionale - afferma Roberto Vivian segretario Fps Cisl -.,"Roberto Vivian, Fps Cisl"
201,Siamo in piena campagna elettorale per il rinnovo delle Rsu e l'azione denigratoria di talune sigle sindacali appare quasi una strategia in vista dell'appuntamento di metà novembre data delle elezioni.,Rsu
205,«Questa è una pericolosa anomalia - continua Vivian -.,Vivian
207,In questa fase in difesa del salario chiederemo all'Apran il saldo previsto per il 2002 - 2003 sullo stipendio nella stessa misura corrisposta dal contratto nazionale della sanità anche con un accordo parziale da sottoscrivere quanto prima per proseguire poi la trattativa su tutte le altre materie».,Apran
209,«La Cisl ha vinto il ricorso contro l'Azienda sanitaria che nell'accordo decentrato successivo al contratto provinciale 2002 ha utilizzato risorse destinate alla riqualificazione del personale non sanitario per altri fini.,"Cisl, Azienda sanitaria"
210,Si tratta di 300 mila euro - ricorda Pierachille Dalledonne segretario Uil sanità -.,"Pierachille Dalledonne, Uil sanità"
212,«Attendiamo la verifica richiesta all'Apran sulle risorse disponibili non solo per il 2002 - 2003 ma anche per il 2004 - 2005 - conclude Vivian -.,"Apran, Vivian"
214,Toni e Totti hanno mostrato una buona intesa nell'amichevole con l'U18,"Toni, Totti, U18"
215,FIRENZE - E'finita 5 - 2 l'amichevole che l'Italia ha giocato contro l'Under 18 a Coverciano.,"Italia, Under 18"
216,Due tempi di 50'cui non hanno preso parte Gattuso e Nesta che sono rimasti ad allenarsi su un campo adiacente.,"Gattuso, Nesta"
217,Con loro all'inizio anche Zambrotta che Lippi ha poi fatto entrare al 26'del secondo tempo al posto di Pancaro.,"Zambrotta, Lippi, Pancaro"
218,Il ct ha provato all'inizio un 4 - 2 - 3 - 1 con Toni punta centrale Totti a supporto Esposito a sinistra e De Rossi - Blasi coppia centrale di centrocampo.,"Toni, Totti, Esposito, De Rossi, Blasi"
219,Nel primo tempo il migliore è stato proprio De Rossi che ha ha preso subito una traversa di testa e che si è fatto trovare sempre nel vivo del gioco sia davanti alla difesa per avviare l'azione sia in fase conclusiva.,De Rossi
220,Male invece Esposito forse bloccato dall'emozione che ha fallito due gol clamorosi e non è sembrato vivace come col Cagliari.,"Esposito, Cagliari"
221,In crescendo la partita di Totti la prima in azzurro dopo gli Europei.,Totti
222,Suo l'assist al 14'per il primo gol di Toni (destro a incrociare sotto la traversa) e suo al 26'il tiro da fuori deviato poi da Castroni alle spalle di Consigli.,"Toni, Castroni, Consigli"
223,Per l'Under 18 gol al 28'di Acquafresca che ha infilato Buffon con un gran tiro da dentro l'area.,"Under 18, Acquafresca, Buffon"
224,Nel secondo tempo Lippi è passato al 4 - 4 - 2 con Di Vaio largo a sinistra e Corradi - Gilardino davanti.,"Lippi, Di Vaio, Corradi, Gilardino"
225,Ha giocato bene Perrotta che ieri per la prima volta ha preso confidenza col pallone e che è pure andato a segno.,Perrotta
226,Prima di lui però era stato Di Vaio ad aprire le marcature nella ripresa con un diagonale di sinistro mentre dopo il 4 - 2 di Momentè è stato Zambrotta a fissare il definitivo 5 - 2 con un destro potente dopo un gran numero sulla fascia sinistra.,"Di Vaio, Momentè, Zambrotta"
228,14'pt Toni 26'pt Totti 28'pt Acquafresca (U. 18) 18'st Di Vaio 32'st Momentè (U. 18) 34'st Perrotta 42'st Zambrotta.,"Toni, Totti, Acquafresca, U. 18, Di Vaio, Momentè, U. 18, Perrotta, Zambrotta"
229,ITALIA pt (4 - 2 - 3 - 1):,ITALIA
230,Bonera Cannavaro Materazzi Pancaro;,"Bonera, Cannavaro, Materazzi, Pancaro"
231,Blasi De Rossi;,"Blasi, De Rossi"
232,Camoranesi Totti Esposito;,"Camoranesi, Totti, Esposito"
233,ITALIA st (4 - 4 - 2):,ITALIA
234,Pelizzoli;,Pelizzoli
235,Oddo Zaccardo Materazzi Pancaro (26'Zambrotta);,"Oddo, Zaccardo, Materazzi, Pancaro, Zambrotta"
236,Diana Perrotta Fiore Di Vaio;,"Diana, Perrotta, Fiore, Di Vaio"
237,Corradi Gilardino.,"Corradi, Gilardino"
238,Tagliavento di Terni,Tagliavento
241,TRENTO - L'Accademia di Danza Orientale Margarita propone per l'anno Accademico 2004 - 05 i suoi corsi di danza del ventre a cura della maestra e danzatrice Maria Rita Gandra a Riva Arco Torbole sul Garda a partire da quest'oggi con la prima lezione dimostrativa e gratuita con prenotazione telefonica o per e-mail.,"Accademia di Danza Orientale Margarita, Maria Rita Gandra, Garda"
247,Moratti vuole Egidi al suo fianco,"Moratti, Egidi"
249,Potrebbe prendere il posto di De Maio,De Maio
250,"Non ha ancora abbandonato l'ufficio di via Belenzani - dove ha lavorato per 8 anni - e già fioccano le"" offerte di lavoro"".",via Belenzani
251,Dopo due mandati nella cabina di comando dell'Università di Trento dove si è fatto apprezzare ora non ha che l'imbarazzo della scelta.,Università di Trento
254,"Massimo Egidi rettore uscente fra poche settimane lascerà il posto al neoeletto Davide Bassi ma di sicuro non avrà problemi di"" collocamento"".",Davide Bassi
256,"Nei giorni scorsi è stato dipinto come il candidato ideale alla presidenza dell'Itc futura Fondazione Kessler dopo l'"" era Bonvicini"".","Itc, Fondazione Kessler"
257,Ma Egidi che ha avuto modo di allacciare forti legami a livello nazionale anche in quanto membro del direttivo della Crui (Conferenza dei rettori) potrebbe puntare ad un ruolo strategico a Roma a fianco del ministro Letizia Moratti con cui è in ottimi rapporti.,"Egidi, Crui, Conferenza dei rettori, Letizia Moratti"
259,Massimo Egidi potrebbe infatti mettersi alla guida di quella che fino a qualche tempo fa veniva chiamata «Commissione De Maio» dal nome del rettore della Luiss.,"Massimo Egidi, Commissione De Maio, Luiss"
261,Adriano De Maio ha lasciato la carica e suo successore ideale sembra essere proprio l'inquilino del rettorato di Trento.,Adriano De Maio
262,Il possibile valzer di poltrone è dato come più che probabile dal Il Mondo la rivista economica che dedica particolare attenzione all'universo dell'accademia in Italia.,Il Mondo
263,A fine luglio Adriano De Maio ha abbandonato la commissione ministeriale impegnata a rinnovare il quadro giuridico dei docenti e le nuove classi di laurea.,Adriano De Maio
264,«Proprio su questo tema - si legge nella rubrica «In cattedra» - le proposte formulate da De Maio (come l'accorpamento delle classi di laurea) sono finite nel cassetto:,De Maio
265,non piacevano a ordini professionali e al sottosegretario Maria Grazia Siliquini».,Maria Grazia Siliquini
266,Pare che la rottura sia dovuta alla mancata nomina di De Maio alla presidenza del Cnr.,"De Maio, Cnr"
267,In questa fase entra quindi in gioco Massimo Egidi.,Massimo Egidi
268,Letizia Moratti potrebbe puntare sul rettore uscente che in commissione andrebbe ad operare assieme a Francesco Alberoni e Fabio Roversi Monaco.,"Letizia Moratti, Francesco Alberoni, Fabio Roversi Monaco"
269,A pochi giorni dalla fine del secondo mandato Egidi ha davanti due strade tra cui scegliere:,Egidi
270,una conduce all'Istituto trentino di cultura l'altra a Roma.,Istituto trentino di cultura
273,Confermati i vertici di Viale Mazzini.,Viale Mazzini
276,Rai l'Udc cambia idea.,"Rai, Udc"
278,ROMA - Il cda Rai può restare in sella fino a giugno 2005.,"cda, Rai"
279,La commissione di Vigilanza licenzia infatti senza modifiche lo statuto della nuova società nata dalla fusione di Rai Spa e Rai Holding e a sorpresa l'Udc si allinea alla Cdl dando l'ok al documento.,"Rai Spa, Rai Holding, Udc, Cdl"
280,Neanche viene messa ai voti la bozza di parere stilata dal presidente Petruccioli con il no alla proroga del consiglio bollato dagli stessi centristi come delegittimato.,"Petruccioli, consiglio"
281,L'opposizione grida al «voltafaccia» e al «patto occulto» nella maggioranza in cambio di chissà quale contropartita l'Udc replica parlando di «scelta gestionale» dettata dalla necessità di non bloccare l'iter della nuova Rai.,"Udc, Rai"
282,Chi immaginava che ieri si ripetesse a Palazzo San Macuto lo schieramento trasversale che a luglio si espresse nell'ultimatum al cda - a casa entro il 30 settembre - viene smentito subito dal capogruppo Udc.,"cda, Udc"
283,In apertura di seduta Iervolino annuncia il parere favorevole al documento di Forza Italia An e Lega Nord per il sì allo statuto così com'è stato approvato dalle assemblee di Rai Spa e Rai Holding.,"Iervolino, Forza Italia, An, Lega Nord, Rai Spa, Rai Holding"
284,«Non abbiamo firmato il documento per rimarcare un distinguo che ci vede in totale dissenso rispetto alle problematiche del cda» spiega Iervolino «ma l'iter non va bloccato:,"cda, Iervolino"
285,abbiamo bisogno che la Rai parta sia pure con un vertice delegittimato politicamente».,Rai
287,Non riesce neanche al capogruppo della Margherita Gentiloni il tentativo di inserire sotto forma di subemendamento al documento l'appello al consiglio a dimettersi non appena conclusa la fusione:,"Margherita, Gentiloni, consiglio"
288,anche in questo caso la Cdl è compatta e i no sono 19 contro 18 sì.,Cdl
289,Reagisce subito dall'opposizione il presidente dei Verdi Pecoraro Scanio che parla di «incredibile voltafaccia dell'Udc» e si chiede se non siano «stati siglati patti occulti sulla pelle dell'azienda».,"Verdi, Pecoraro Scanio, Udc"
290,Dai Ds Giulietti bolla il voto della Vigilanza come «gravissimo» e intravede il rischio che si vada «verso una repubblica presidenziale a reti unificate».,"Ds, Giulietti"
