id,Sentence,Entities
5144,BASKET C2 / Ufficializzato l'ingaggio del 20enne play - maker italo - argentino.,C2
5146,Il «gaugho» Andres Santori per la Virtus Gardascuola,"Andres Santori, Virtus Gardascuola"
5148,la Virtus Gardascuola ha trovato il play - maker che cercava.,Virtus Gardascuola
5149,Si tratta dell'argentino di passaporto italiano Andres Santori classe'84 182 cm sbarcato in Italia nel gennaio di quest'anno giocando mezza stagione a Fabriano in C2 segnando 14 punti di media.,"Andres Santori, C2"
5150,Con la Virtus giocherà anche il campionato «under 21».,"Virtus, under 21"
5151,Il nuovo giocatore che va a completare il roster della squadra di coach Gabrielli arriverà martedì prossimo in Italia direttamente dal Sudamerica.,Gabrielli
5152,Lunedì intanto anche Walter Bobicchio (nella foto) ha cominciato la preparazione con il gruppo al rientro da un periodo di ferie.,Walter Bobicchio
5153,Per il popolare «Bobo» comincia una nuova stimolante avventura.,Bobo
5155,Alle 18 al PalaGarda va in scena l'amichevole tra Garda Cartiere con l'ex Paoli e Sosi Trento.,"Garda Cartiere, Paoli, Sosi Trento"
5157,nell'altra sfida alle 21.30 la Manica Trenta affronterà Gorizia (B1).,"Manica Trenta, Gorizia, B1"
5160,Ma Patt Forza Italia e Lega attaccano comunque,"Patt, Forza Italia, Lega"
5161,Trentino trasporti «festa sobria»,Trentino trasporti
5162,Questa non è la festa di Trentino Trasporti ma la «Festa della Musica» a cui la società ha dato ospitalità.,Trentino Trasporti
5163,Trentino Trasporti smentisce ma il Patt Bertolini e Merler non perdono l'occasione per criticare.,"Trentino Trasporti, Patt, Bertolini, Merler"
5164,Trentino trasporti smentisce gli «eventi inaugurali della nuova sede societaria.,Trentino trasporti
5169,Si tratterà della Festa della musica che rientra in una serie di iniziative della Federazione dei cori trentini e della Federazione dei corpi bandistici».,"Federazione dei cori trentini, Federazione dei corpi bandistici"
5170,In tutto ciò la Trentino Trasporti «ha dato la sua disponibilità per un modesto intervento economico che si tradurrà in una messa a disposizione di alcuni autobus per,Trentino Trasporti
5172,Ma intanto l'ufficio politico del Patt esprime «forte sdegno».,Patt
5174,Il Patt parla anche di «irrispettosa e arrogante pubblicizzazione dell'evento».,Patt
5175,Il consigliere provinciale della Lega Denis Bertolini su questa festa «scandalosa» ha redatto una interrogazione da proporre in consiglio Provinciale.,"Lega, Denis Bertolini, consiglio Provinciale"
5176,E il consigliere comunale di Trento di Forza Italia Luigi Merler durante il question time ha chiesto al sindaco Pacher quali siano i costi della manifestazione che «probabilmente stride con la situazione congiunturale attuale».,"Forza Italia, Luigi Merler, Pacher"
5179,Di RENZO M. GROSSELLI,RENZO M. GROSSELLI
5184,Antonio Schizzerotto è professore di Storia del pensiero sociologico alla Facoltà di Sociologia dell'Università Bicocca di Milano.,"Antonio Schizzerotto, Facoltà di Sociologia, Università Bicocca"
5186,Ha lavorato alla Facoltà di Sociologia di Trento dal 1968 al 1997 anche come direttore del Dipartimento di Sociologia e Ricerca sociale.,"Facoltà di Sociologia, Dipartimento di Sociologia e Ricerca sociale"
5187,È stato quindi preside della stessa Facoltà dal 1993 al 1996 (un anno lo ha trascorso ad Oxford invitato al Nuffield College).,"Facoltà, Nuffield College"
5188,Professor Schizzerotto la rappresentanza politica trentina è scivolata nella stessa crisi che sta martoriando il sistema politico italiano?,Schizzerotto
5190,La DC si è frammentata:,DC
5191,Margherita Forza Italia e altre componenti della galassia.,"Margherita, Forza Italia"
5201,Eppure le statistiche Istat hanno parlato di nuove povertà in Trentino.,Istat
5209,(ndr sorride Schizzerotto).,Schizzerotto
5219,Professor Schizzerotto quando la struttura provinciale si appresta a definire il nuovo bilancio annuale decine di ripartizioni si affrettano a spendere somme anche ingenti per la sola ragione di non vedersi tagliare i fondi per l'anno successivo...,Schizzerotto
5246,Antonio Schizzerotto lei ama il Trentino.,Antonio Schizzerotto
5248,Betta richiama gli alleati «che puntano solo alle proprie identità».,Betta
5250,Margherita il 25% alle donne,Margherita
5251,La Margherita - dopo l'incontro di maggioranza - ha riunito il parlamentino.,Margherita
5253,Lo stesso coordinatore Mauro Betta rintracciato in mattinata non aveva fatto mistero di attendere sviluppi:,Mauro Betta
5257,«Abbiamo raggiunto una forte condivisione sul metodo di lavoro per affrontare le priorità di governo - ha detto Betta - dalla riforma istituzionale al regolamento alla mobilità ricerca formazione welfare».,Betta
5258,In ottobre la Margherita avvierà la fase congressuale.,Margherita
5262,Mauro Betta non dovrebbe avere rivali per la conferma del ruolo di coordinatore.,Mauro Betta
5263,Ieri le donne della Margherita hanno presentato un emendamento alle regole congressuali che è stato approvato:,Margherita
5266,Penelope e le altre,Penelope
5269,Patrizia Frontini archeologa che opera presso il Castello Sforzesco di Milano condurrà gli intervenuti in un percorso guidato che avrà come protagonista la figura femminile dalle più antiche comunità di agricoltori e allevatori fino all'epoca dei Celti.,Patrizia Frontini
5273,"La ragazza di Mattarello campionessa italiana Allieve vince i 100 in un bel 12"" 13.",Allieve
5274,Altro bronzo per Deimichei,Deimichei
5275,Martina Giovanetti «firma» anche gli Studenteschi,Martina Giovanetti
5277,"A pochi giorni dagli Italiani allievi si è confermata ai vertici nazionali Martina Giovanetti (Liceo Da Vinci Trento) che ha dominato i 100 nel nuovo primato personale di 12"" 13.","Martina Giovanetti, Liceo Da Vinci"
5278,"Ancora bronzo per il compagno di allenamento Davide Deimichei (ITI Marconi Rovereto) non soddisfatto del suo 11"" 38 (11"" 32 in seminfinale) dopo una corsa troppo contratta.","Davide Deimichei, ITI Marconi"
5280,"Cinzia Baldessari (Liceo Prati) è stata comunque 4ª sui 1000 (2'59"" 89 in finale 2'59"" 78 in batteria) mentre il campione italiano dei 400 hs Mattia Graziola (Enaip di Borgo) si è ben difeso nel lungo (9° con 6.25).","Cinzia Baldessari, Liceo Prati, Mattia Graziola, Enaip"
5282,Alessia Trentin (Ist.,"Alessia Trentin, Ist ."
5283,"Borgo) è arrivata 10ª nel lungo (5,02) Anthea Marchi (Ist.","Anthea Marchi, Ist ."
5285,Sui 100 ostacoli 12° posto per Luisa Costa (Ist.,"Luisa Costa, Ist ."
5286,"Borgo) con 15"" 47 mentre la staffetta 4x100 del Liceo Da Vinci (Tovazzi Cestari Slomp e Giovanetti) è finita 10ª.","Liceo Da Vinci, Tovazzi, Cestari, Slomp, Giovanetti"
5287,"Sui 110 ostacoli 14° Alessandro Nicoletti (ISA Trento) un ragazzo dall'ottimo"" ritmo"" ma ancora troppo litigioso con gli ostacoli.","Alessandro Nicoletti, ISA"
5288,Nell'alto 9° Andrea Zuanni (Lic.,"Andrea Zuanni, Lic ."
5289,"Rosmini Rovereto) con 1,75 - in qualificazione aveva saltato senza problemi 1,85.",Rosmini
5290,I due istituti che hanno rappresentato il Trentino si sono piazzati 13° (Liceo Da Vinci) e 21° (Liceo Galilei di Trento).,"Liceo Da Vinci, Liceo Galilei"
5292,"Christina Tauber (RG Brunico) ha vinto i 100 ostacoli in 14"" 68 e Simone Capisani (Hob Bolzano) si è piazzato 2° nel peso (15,10).","Christina Tauber, RG, Simone Capisani, Hob"
5296,È questo il primo commento di Monica Baldo una delle madri che si era schierata con N.D. l'insegnante di matematica e scienze che ora andrà a fare sostegno alla scuola Pigarelli.,"Monica Baldo, N.D., scuola Pigarelli"
5301,Secondo Baldo a volte la maestra non è stata apprezzata perché «diretta».,Baldo
5308,Chiara Stefanini pensa ai bambini che ora avranno tre supplenti:,Chiara Stefanini
5311,Alla maestra N.D contesta solo di non avere avvertito i genitori della sua intenzione di dedicare una lezione all'argomento:,N.D
5327,Il leghista Pagliarini sui pedaggi autostradali:,Pagliarini
5329,Visco a Siniscalco:,"Visco, Siniscalco"
5331,ROMA - Se mai è esistito un feeling fra il successore di Giulio Tremonti e Vincenzo Visco dopo l'audizione di ieri del ministro Siniscalco in commissione Bilancio della Camera sembra definitivamente tramontato.,"Giulio Tremonti, Vincenzo Visco, Siniscalco, commissione Bilancio, Camera"
5332,Visco accusa Siniscalco di fare un imbroglio sul «tetto del 2%» e il ministro replica spiegando che il problema sembra talvolta semantico tanto che servirebbe un'audizione ad Umberto Eco.,"Visco, Siniscalco, Umberto Eco"
5333,Visco è a tratti indignato e appare lontano da quello che lo stesso ex ministro delle Finanze fece lo scorso agosto in occasione della presentazione del Dpef.,Visco
5335,«E'bravo ha capovolto la linea di politica economica della Cdl ma ora lo aspetta un compito molto difficile».,Cdl
5338,il tetto del 2% è in realtà «un taglio di spesa» un'idea «propagandistica» incalza Visco in un crescendo di indignazione che culmina in un «ministro ovvia!,Visco
5339,Con garbo replica utilizzando l'arma politica dell'ironia anche Siniscalco.,Siniscalco
5343,La prossima volta faremo le audizioni con Umberto Eco».,Umberto Eco
5345,Sulla questione pedaggi il ministro Siniscalco ribadisce che:,Siniscalco
5347,Ma il leghista Giancarlo Pagliarini è poco convinto delle spiegazioni del ministro:,Giancarlo Pagliarini
5351,«Anche Riccardo Dossi era d'accordo»,Riccardo Dossi
5354,Di FABRIZIO TORCHIO,FABRIZIO TORCHIO
5356,La politica dei Verdi sale sul palco e diventa show in uno spettacolo multiculturale che girerà la provincia nel 2005 a favore delle nuove aree protette.,Verdi
5357,«Ci sarà un sito internet - annuncia Roberto Bombarda il firmatario del disegno di legge su «un terzo al futuro» - e per ogni parco una pubblicazione».,Roberto Bombarda
5359,Arriva a ridosso delle elezioni comunali ma Bombarda non se ne duole:,Bombarda
5363,È farina del capace sacco ambientalista e dei Verdi prima maniera.,Verdi
5364,Di tutela del Cadria i botanici parlavano nel primo dopoguerra e il Wwf aveva proposto il parco del Lagorai nel 1976.,"Cadria, Wwf, parco del Lagorai"
5365,Nel'93 - c'era anche il simbolo la marmotta - ma poi il disegno di legge Franceschini - Boato aveva cozzato contro molte opposizioni Val di Fiemme in primis.,Val di Fiemme
5366,L'esclusione dei vasti territori di bosco «coltivato» della Magnifica comunità è la logica contromossa odierna.,Magnifica comunità
5367,Di parchi «a medio termine» - Lagorai e Cima d'Asta Bondone Baldo Pasubio - Piccole Dolomiti e ampliamento dello Stelvio - s'era poi occupato a lungo negli anni'80 il verde Sandro Boato evolvendo i concetti di tutela delle riserve demaniali nei siti ecologicamente più interessanti.,"Lagorai, Cima d' Asta, Bondone, Baldo, Pasubio - Piccole Dolomiti, Stelvio, Sandro Boato"
5368,Bombarda la proposta è in gran parte aderente a quella irrealizzata degli anni'80.,Bombarda
5369,«Nel 1986 il consiglio provinciale aveva approvato una mozione di Tonelli sui nuovi parchi ma le forti novità di questi anni sono state la nascita delle Rete alpina delle aree protette e la Rete natura.,"consiglio provinciale, Tonelli, Rete alpina delle aree protette, Rete natura"
5371,Il parco del Bondone?,parco del Bondone
5373,Tutelare le rocce del Latemar che per metà è altoatesino e già raggiunto da impianti e non Mamolada o Catinaccio?,"Latemar, Mamolada, Catinaccio"
5374,«Il parco del Latemar salda due Sic due siti di interesse comunitario per i quali la direttiva Habitat Ue prevede piani di gestione.,"parco del Latemar, Sic"
5375,"E il parco è lo"" step"" mancante al corridoio ecologico secondo la visione della Rete e dell'Iucn l'Unione internazione per la conservazione della natura».","Rete, Iucn, Unione internazione per la conservazione della natura"
5378,alcune funzioni vanno centralizzate a livello di Servizio parchi della Provincia che può così rinascere;,Servizio parchi
5381,Ma alla rete fatta di parchi Sic e biotopi serve una regia unitaria e va affidata al Servizio parchi».,"Sic, Servizio parchi"
5386,Il parco del Lagorai è già stato «bocciato» una volta.,parco del Lagorai
5387,Credo che Tesino e Valsugana siano favorevoli ma sottolineo il fatto che per alcune aree in particolare - Concei o Vallarsa - i parchi sarebbero le uniche opportunità di sviluppo possibili».,"Concei, Vallarsa"
5390,«Riccardo Dossi che da sindaco al parco del Baldo ci credeva tanto da inserirlo nel Prg di Brentonico da consigliere mi spronava.,"Riccardo Dossi, parco del Baldo"
5392,E i confini del Prg di Brentonico approvato con due adozioni del consiglio comunale sono più ampi dei miei.,consiglio comunale
5397,L'Ue si fa notare a Bruxelles non vuole assolutamente alimentare la polemica con il governo di Mosca che ha definito «blasfema» la richiesta di informazioni fatta dalla presidenza olandese dell'Unione.,presidenza
5399,Presidenza olandese e Commissione gettano acqua sul fuoco perché non vogliono aprire un altro fronte ma ci tengono a chiarire che coloro che formulano critiche contro Bruxelles lo fanno non tenendo conto di tutte le prese di posizione e stravolgendo le dichiarazioni.,"Presidenza, Commissione"
5402,In proposito c'è tra le altre una dichiarazione della presidenza europea del 2 settembre - prima del massacro - in cui l'Unione Europea dichiarava la condanna «per la presa di ostaggi in una scuola» accompagnata dalla richiesta «ai responsabili di rilasciare immediatamente tutti gli ostaggi» perché «minacciare e traumatizzare bambini genitori e insegnanti è esecrabile».,presidenza
5407,Rimane lo scioglimento del consiglio quando si elegge il Senato,"consiglio, Senato"
5410,Di PIERANGELO GIOVANETTI,PIERANGELO GIOVANETTI
5412,Il governo Berlusconi non ha nessuna intenzione di modificare la riforma del federalismo per garantire la revisione dello Statuto in maniera consensuale con il Trentino Alto Adige né di eliminare la contestualità delle elezioni per il Senato federale e le Provinciali (che darebbe al Capo dello Stato il potere di sciogliere il consiglio provinciale).,"Senato federale, consiglio provinciale"
5415,IL VERTICE DA CALDEROLI - È questo quanto comunicato ieri dal ministro alle Riforme Roberto Calderoli ai vertici delle Province e delle Regioni speciali giunti a Roma per chiedere garanzie istituzionali nei confronti delle autonomie speciali.,"CALDEROLI, Roberto Calderoli"
5416,All'incontro erano presenti i presidenti delle Province di Trento e Bolzano Lorenzo Dellai e Luis Durnwalder il presidente del consiglio regionale Mario Magnani e del consiglio provinciale Giacomo Bezzi.,"Lorenzo Dellai, Luis Durnwalder, consiglio regionale, Mario Magnani, consiglio provinciale, Giacomo Bezzi"
5417,Il ministro Calderoli pur ribadendo la sua personale convinzione a favore delle posizioni delle autonomie speciali ha opposto il no secco della maggioranza ad accogliere le richieste.,Calderoli
5421,«È paradossale che una riforma costituzionale nata per il federalismo rischi di ridurre l'autonomia che già oggi viene garantita alle Regioni e alle Province a Statuto speciale» ha commentato il presidente Dellai appena uscito dal vertice con Calderoli.,"Dellai, Calderoli"
5424,Duri anche i commenti espressi dai presidenti Magnani e Bezzi.,"Magnani, Bezzi"
5425,«L'incontro è andato male» ha dichiarato il presidente del consiglio.,consiglio
5426,E Magnani ha aggiunto:,Magnani
5429,CLAUSOLA DI MIGLIOR FAVORE - L'unico punto su cui il ministro Calderoli ha dato rassicurazioni è stato quello della cosiddetta «clausola di miglior favore».,Calderoli
5431,Un passaggio non da poco che però è stato subito dopo ridimensionato da Calderoli quando ha ribadito che «comunque resta in vigore il principio di interesse nazionale che si applica anche nei confronti del Trentino».,Calderoli
5432,Questo vuol dire che il Senato federale potrebbe annullare leggi delle autonomie in nome dell'interesse nazionale concetto peraltro abbastanza generico.,Senato federale
5433,«Il Senato è un organismo politico» ha obiettato subito Dellai.,"Senato, Dellai"
5439,La richiesta delle autonomie era di avere rappresentanze paritarie nel nuovo Senato federale.,Senato federale
5440,Calderoli ha rimandato tutto ad un nuovo modello che sta elaborando e di cui non si conoscono ancora i contorni.,Calderoli
5442,ROMA - La sconfitta se ci sarà non sarà la sua ma di «tutta la Cdl» perchè è quantomeno «antipatico» definire il ddl di modifica dell'ordinamento giudiziario come «la riforma Castelli quando minaccia di arrestarsi» mentre «quando va avanti diventa la riforma della Cdl».,"Cdl, Cdl"
5444,Dopo l'ennesima correzione al testo resta da decidere in che modo e in quali termini «sblindare» il ddl ora fermo in Commissione.,Commissione
5445,Castelli non avrebbe alcuna intenzione di presentare un ennesimo maxiemendamento anche se sul punto non si sbilancia:,Castelli
5449,MILANO - A conclusione di una raccolta di firme per una petizione popolare a sostegno di una delibera contro il burqa la Lega Nord ha organizzato per oggi una manifestazione durante la quale i leghisti sfileranno con il volto coperto da piazza San Babila dove c'è il banchetto per le sottoscrizioni fino in Prefettura.,"Lega Nord, piazza San Babila"
5450,Una delegazione ha chiesto di essere ricevuta dal prefetto Bruno Ferrante e durante l'incontro il segretario provinciale del Carroccio Matteo Salvini esporrà i problemi del degrado e dell'illegalità presenti in città.,"Bruno Ferrante, Carroccio, Matteo Salvini"
5452,FIRENZE - Un dirigente della Provincia di Firenze Giovanni Assini e il titolare di un'impresa di pulizie Giancarlo Del Negro sono stati arrestati ieri dalla guardia di finanza di Firenze per un'inchiesta su presunte tangenti che sarebbero state pagate per aggiudicarsi due gare d'appalto per il servizio di pulizia di uffici e locali dell'amministrazione provinciale.,"Giovanni Assini, Giancarlo Del Negro"
5453,Entrambi sono finiti agli arresti domiciliari con l'accusa di corruzione in esecuzione di misure cautelari disposte dal gip su richiesta del procuratore aggiunto di Firenze Francesco Fleury e del pm Giuseppe Nicolosi.,"Francesco Fleury, Giuseppe Nicolosi"
5454,Rom Avvocatura contro Tribunale,"Avvocatura, Tribunale"
5455,MILANO - L'Avvocatura dello Stato ha presentato ricorso in Cassazione contro la sentenza del Tribunale di Milano che ha dichiarato nulli i provvedimenti con i quali sono stati espulsi 16 rom di nazionale romena che avevano occupato lo stabile dell'ex fabbrica Zucchi sgomberato dalla polizia lo scorso marzo.,"Avvocatura dello Stato, Cassazione, Tribunale di Milano"
5462,L'iniziativa è proposta da una rete di realtà ambientaliste del Trentino e del Veneto composta da Cipra - Italia Italia Nostra - Sezione del Trentino Legambiente del Trentino Commissione TAM Veneto - Friuli Venezia Giulia Mountain Wilderness - Italia WWF Trentino - Alto Adige Lipu Lega Antivivisezionista Italiana.,"Cipra - Italia, Italia Nostra, Legambiente, Commissione TAM, Mountain Wilderness - Italia, WWF, Lipu, Lega Antivivisezionista Italiana"
5468,Lo ha disposto la giunta provinciale con delibera del 30 agosto scorso riguardante il riparto del Fondo a sostegno di specifici servizi comunali ammettendo a finanziamento le spese per la gestione dei campi di sosta per i nomadi previsti dalla legge n. 15 del 1985.,giunta provinciale
5470,"Con la recente delibera proposta dall'assessore Grisenti si stabilisce il riparto di tale quota in uguale importo tra i due Comuni di Trento e Rovereto effettuato applicando alle assegnazioni relative al 2003 il tasso programmato d'inflazione pari all'1,7% il limite per la crescita dei trasferimenti correnti per specifici servizi comunali.",Grisenti
5473,Per consentire alla ditta Collini di completare l'imbocco della nuova galleria di Cadine è stata prorogata l'ordinanza che istituiva la deviazione temporanea del traffico della statale 45 bis Gardesana e la limitazione della velocità a 40 chilometri orari.,Collini
5477,Prime aperture da Monti e Pontalti ma Filippin tiene duro,"Monti, Pontalti, Filippin"
5478,Di FRANCO GOTTARDI,FRANCO GOTTARDI
5480,C'è modo di convincere Filippin Monti e Pontalti a rinunciare ai loro 940 emendamenti?,"Filippin, Monti, Pontalti"
5481,Andreatta ci sta provando e ieri sembrano essersi aperti i primi spiragli per una trattativa.,Andreatta
5482,Paolo Monti al termine del suo lungo intervento è stato chiarissimo:,Paolo Monti
5484,Il consigliere del Patt ha spiegato che a lui stanno in particolare a cuore le istanze del mondo produttivo di quegli artigiani che hanno chiesto aree di espansione.,Patt
5485,Un tema che l'assessore Andreatta avrebbe voluto rinviare a una prossima manovra urbanistica ma che a questo punto potrebbe anche prendere in considerazione.,Andreatta
5488,Sono la bellezza di 62 più o meno quelle che il consiglio comunale fa in un anno.,consiglio comunale
5490,Per il momento il consiglio è stato prolunfgato fino a mercoledì prossimo.,consiglio
5491,Anche con Raoul Pontalti c'è l'impressione di un possibile patto.,Raoul Pontalti
5492,La cosa che sta maggiormente interessa al consigliere di Alleanza Nazionale è l'individuazione di un'area adeguata per il canile municipale che dovrà sloggiare tra non molto da maso Sembenotti destinato ad essere raso al suolo per fare spazio al nuovo svincolo lungo la circonvallazione.,Alleanza Nazionale
5494,Andreatta ha recentemente dichiarato la sua propensione a riproporre l'ex azienda agricola di Camparta che in passato era stata scartata perché troppo decentrata.,Andreatta
5495,Pontalti invece è contrario e insiste per una soluzione nel fondovalle.,Pontalti
5496,Resta da capire se vi siano margini di contrattazione con il leghista Giuseppe Filippin.,Giuseppe Filippin
5500,Filippin però per il momento sembra intenzionato a tener duro:,Filippin
5503,Leo Vilardi ad esempio pur richiamandosi a una disciplina di coalizione che decide a maggioranza ha voluto tenere sulla corda il centrosinistra rinviando alla fine del dibattito la decisione sul voto di Confronto Sociale.,"Leo Vilardi, Confronto Sociale"
5505,L'autonomista Alberto Pattini ha lodato il clima e lo spirito con cui la commissione urbanistica ha lavorato in questi mesi alla costruzione della variante e si è soffermato sull'ottimo lavoro fatto dagli uffici per mettere sotto tutela una serie di edifici storici dei primi del Novecento architettonicamente degni di nota.,"Alberto Pattini, commissione urbanistica"
5506,Oltre a insistere affinché si trovi una soluzione diversa per la scuola Steineriana il verde Aldo Pompermaier si è soffermato sulle aree per l'edilizia agevolata.,Aldo Pompermaier
5509,Infine Sergio Cappelletti a nome della Margherita ha puntualizzato alcuni aspetti tecnici auspicando la modifica della norma dei sottotetti togliendo i riferimenti alla coerenza architettonica per lasciare piena libertà di giudizio alla commissione edilizia e dichiarandosi a favore dell'accoglimento delle domande di trasformazione in verde agricolo dei lotti coltivati ma cartograficamente descritti come bosco:,"Sergio Cappelletti, Margherita, commissione edilizia"
5511,Michelin manifestazione in Provincia.,Michelin
5514,TRENTO - Ieri la Stl oggi la Michelin e tutte le altre industrie a rischio chiusura o delocalizzazione.,"Stl, Michelin"
5515,A partire dalle 9.30 i lavoratori del comparto in sciopero manifesteranno davanti alla sede del consiglio provinciale in piazza Dante.,"consiglio provinciale, piazza Dante"
5516,Un presidio deciso unitariamente da Cgil Cisl e Uil per portare il tema delle crisi industriali all'attenzione dei consiglieri impegnati nei lavori d'aula.,"Cgil, Cisl, Uil"
5517,Una delegazione sindacale verrà ricevuta dal presidente della giunta provinciale Lorenzo Dellai che ha convocato per mercoledì prossimo un vertice allargato su questo problema al quale parteciperanno tutte le parti sociali.,"giunta provinciale, Lorenzo Dellai"
5518,I lavoratori coinvolti dallo sciopero di oggi dovrebbero essere un migliaio parte dei quali è attesa in piazza Dante.,piazza Dante
5521,l'incontro tra i sindacati di categoria e i vertici di Michelin Italiana per un primo confronto sulla gestione dell'annunciata chiusura di Spini di Gardolo.,Michelin Italiana
5522,ECCELLENZA / Ieri la firma,ECCELLENZA
5523,Paolo Panizza nuovo mister dell'Albiano,"Paolo Panizza, Albiano"
5524,TRENTO - E'Paolo Panizza il giovane ex tecnico di Comano Fiavè Anaune Campiglio il nuovo mister dell'Albiano.,"Paolo Panizza, Comano Fiavè, Anaune, Campiglio, Albiano"
5525,Dopo le dimissioni shock di Memmo che all'inizio dei questa settimana aveva lasciato la squadra cogliendo in contropiede in po'tutto l'ambiente la dirigenza rossonera è corsa ai ripari contattando diversi allenatori fra quelli ancora liberi sulla piazza.,Memmo
5526,Da Claudio Coppi a Massimo Fabbri attraverso Paolo Guadagnini Marco Ferrarol Catello Muollo Roberto Sonato Franco Caveden il diesse Salati in tre giorni convulsi ha sondato le varie disponibilità sottoponendole poi tutte al suo direttivo.,"Claudio Coppi, Massimo Fabbri, Paolo Guadagnini, Marco Ferrarol, Catello Muollo, Roberto Sonato, Franco Caveden, Salati"
5527,Nella tarda serata di ieri la fumata bianca e la scelta di Panizza che in precedenza aveva assistito all'amichevole fra l'Albiano e il Villazzano e che già da oggi guiderà in prima persona l'allenamento del venerdì.,"Panizza, Albiano, Villazzano"
5528,Domenica ovviamente sarà lui in panchina nel delicato match esterno contro l'imbattuta capolista S. Giorgio.,S. Giorgio
5529,Per Panizza si tratta di un importante ritorno in pista dopo l'addio altrettanto clamoroso dell'anno passato quando lasciò il Comano Fiavè proprio alla vigilia del campionato.,"Panizza, Comano Fiavè"
5530,«Sono estremamente contento della chiamata da parte dell'Albiano ha dichiarato prima di cominciare questa nuova avventura.,Albiano
