id,Sentence,Entities
2727,Giocare con lui in nazionale ripetendo posizioni e schemi della Roma facilita».,"nazionale, Roma"
2728,Quanto a Cassano «dico che non è giusto vada via da Roma.,Cassano
2732,E a dire il vero neanche in Nazionale.,Nazionale
2733,«Ho detto e ripeto - conclude De Rossi - che non so quanti allenatori avrebbero avuto il coraggio di farmi esordire a 21 anni come ha fatto Lippi.,"De Rossi, Lippi"
2737,Mi dicono di Tardelli ma di lui ricordo solo l'urlo Mundial.,Tardelli
2738,Ci sono stati Albertini e Giannini...,"Albertini, Giannini"
2739,Di quelli in giro oggi mi piacciono Lampard e Gerrard ma i più forti sono Vieira ed Emerson».,"Lampard, Gerrard, Vieira, Emerson"
2740,E se l'ultimo nome può suonare come ulteriore indicazione pro - Juve a controbilanciarla ci sono le preferenze in tema di allenatori:,Juve
2741,«Völler era il mio idolo da bambino:,Völler
2743,Tra i tecnici ammiro Mancini e poi Prandelli:,"Mancini, Prandelli"
2745,Tanta Roma dunque.,Roma
2747,La condanna dell'assessore alla solidarietà Berasi,Berasi
2749,Decisa condanna per quanto avvenuto ieri a Baghdad e un sentimento di vicinanza alle famiglie delle due volontarie italiane e all'organizzazione «Un ponte per» viene dall'assessore provinciale alla solidarietà internazionale Iva Berasi.,"Un ponte per, Iva Berasi"
2751,Lavoro che proprio le organizzazioni come quella per cui lavorano Simona Pari e Simona Torretta cercano di portare avanti quotidianamente tra mille difficoltà.,"Simona Pari, Simona Torretta"
2753,La Provincia da anni è impegnata in prima fila per il sostegno delle Ong Berasi ricorda quando da assessore del Comune di Trento finanziò i primi progetti con «Un ponte per».,"Berasi, Un ponte per"
2756,VELA / In Coppa America a Valencia re Juan Carlos perde con Alinghi e il ministro Maroni vince con i gardesani,"Juan Carlos, Alinghi, Maroni"
2757,Luna Rossa al comando e primo successo di «+ 39»,"Luna Rossa, + 39"
2758,VALENCIA (Spagna) - Luna Rossa è in testa alla classifica ex aequo con Alinghi e New Zealand della seconda regata preliminare della Coppa America in corso a Valencia.,"Luna Rossa, Alinghi, New Zealand"
2759,Il team di Francesco De Angelis ieri ha battuto prima i francesi di K - Challenge e poi i sudafricani di Shosholoza.,"Francesco De Angelis, K - Challenge, Shosholoza"
2760,Importante il successo di + 39:,+ 39
2761,il team gardesano di Luca Devoti ha battuto proprio Shosholoza e ha ottenuto il suo primo successo ufficiale nell'avvicinamento alla Coppa del 2007.,"Luca Devoti, Shosholoza"
2762,+ 39 ha poi ceduto a K - Challenge nel secondo match race.,"+ 39, K - Challenge"
2763,A Valencia però è stata la giornata di Juan Carlos e del ministro Maroni.,"Juan Carlos, Maroni"
2764,Il re di Spagna appassionato velista ha incontrato i team ed è salito su Alinghi come 18° uomo nella regata poco fortunata contro New Zealand:,New Zealand
2767,Il ministro Roberto Maroni ha portato fortuna a + 39 il 12 metri sponsorizzato dal suo dicastero dalla Regione Sicilia e dalla Provincia di Palermo i cui nomi sono abbinati alla squadra di calcio rosanero e al Valencia campione di Spagna.,"Roberto Maroni, Valencia"
2768,Il varo ministeriale nel gemellaggio tra lago di Garda e mare di Palermo ha così coinciso con la prima vittoria di + 39 nelle regate preliminari della «Louis Vuitton Cup».,"lago di Garda, + 39"
2769,Per cementare il rapporto fra nord e sud inoltre Maroni ha indossato la maglia del Palermo presieduto da Maurizio Zamparini e allenato da Francesco Guidolin che tanto bene sta facendo nel massimo campionato di calcio.,"Maroni, Palermo, Maurizio Zamparini, Francesco Guidolin"
2770,Pur essendo milanista dalla testa ai piedi al termine di una cena del tutto informale a bordo della «Buena Chica» la barca d'appoggio di + 39 il ministro ha accettato di farsi ritrarre con la maglia numero 4 del Palermo che è quella del centrocampista di origini calabre Stefano Morrone.,"+ 39, Palermo, Stefano Morrone"
2771,«Adesso posso dire di essere siciliano honoris causa - ha detto Maroni - rispetto il Palermo però contro il Milan perderà tutte le partite sia in campionato che in Coppa Italia».,"Maroni, Palermo, Milan"
2772,Sulla sfida velico - governativa con il collega Lunardi il ministro Maroni non ha dubbi:,Lunardi
2773,«Luna Rossa ha più soldi ma + 39 è agguerrita sui valori dello sport».,"Luna Rossa, + 39"
2774,Maroni ha inoltre promesso che sarà presente nell'autunno 2005 a Trapani per le regate siciliane dell'Americas Cup.,Maroni
2776,Alinghi (Svi) Emirates New Zealand (Nze) e Luna Rossa 4;,"Alinghi, Emirates New Zealand, Luna Rossa"
2777,Oracle (Usa) 3;,Oracle
2778,Le Defi (Fra) e K - Challenge (Fra) 2;,"Le Defi, K - Challenge"
2779,Shosholoza (Saf) 0.,Shosholoza
2781,D'Alema contro Rutelli:,"D' Alema, Rutelli"
2782,vuole affondare Prodi,Prodi
2783,ROMA - «È in corso una campagna contro Prodi una manovra politica tesa ad indebolirlo»:,Prodi
2784,è la denuncia di Massimo D'Alema ripresa oggi dal giornale Il Riformista vicino alle posizioni del presidente diessino.,"Massimo D' Alema, Il Riformista"
2785,D'Alema sostiene che la proposta di Prodi è l'unica che possa garantire «quel ricambio di classe dirigente del Paese che è necessario» e critica le posizioni di Francesco Rutelli che a suo avviso sono «viziate da un residuo di cultura proporzionalista».,"D' Alema, Prodi, Francesco Rutelli"
2786,Sempre in tema di ricambio delle classi dirigenti D'Alema sottolinea come «curiosamente spesso a denunciare la questione sono degli uomini nuovi solo perché lavati con Perlana» ma appartenenti a una «vecchia Italia» che punta a «far fuori Prodi».,"D' Alema, Prodi"
2787,Riguardo ai contrasti tra il presidente della Commissione europea e il presidente della Margherita D'Alema sostiene che «questa divergenza non si risolverà a tavolino in maniera preliminare con qualche «chiarimento» ma si scioglierà solo lungo la strada nella costruzione di un progetto comune».,"Commissione europea, Margherita, D' Alema"
2789,D'Alema critica la visione politica «centrista» di Rutelli e chiede un «progetto credibile» di tutto l'Ulivo.,"D' Alema, Rutelli, Ulivo"
2790,Rutelli replica con un articolo che appare oggi sul quotidiano Europa:,"Rutelli, Europa"
2796,Cimirlo senza Elastibus,Cimirlo
2797,Giongo attacca Grisenti,"Giongo, Grisenti"
2798,È arrivata come un fulmine a ciel sereno al passo del Cimirlo la notizia della sospensione del servizio Elastibus che dal 26 agosto dell'anno scorso costituiva un'alternativa all'uso dell'auto privata per gli abitanti della zona.,Cimirlo
2799,«Il servizio - sostiene Aldo Giongo ex consigliere comunale che in passato si è sempre battuto per garantire un collegamento di pubblico trasporto tra la zona e la città - ha operato in modo egregio per un anno trasportando gli studenti delle superiori che non possono utilizzare il normale scuolabus gli anziani le casalinghe e quanti non vogliono utilizzare il mezzo privato.,Aldo Giongo
2801,» Giongo svela un retroscena dio qualche giorno fa in occasione di una visita in zona dell'assessore provinciale ai trasporti Silvano Grisenti.,"Giongo, Silvano Grisenti"
2804,«Tra qualche giorno - continua Giongo - cominciano le scuole e gli studenti delle superiori aspetteranno invano l'Elastibus alle sette del mattino.,Giongo
2808,Divina continua la maratona solitaria.,Divina
2811,«Sergio resisti!,Sergio
2812,Mentre buona parte del consiglio provinciale ieri era indifferente o impegnato a preparare gli emendamenti per ottenere aumenti di risorse ai gruppi Sergio Divina (Lega nord) ha continuato la sua maratona ostruzionistica e solitaria contro la riforma del regolamento d'aula che vuole evitare proprio l'ostruzionismo.,"consiglio provinciale, Sergio Divina, Lega nord"
2813,Nei suoi interventi Divina si è scagliato soprattutto contro i suoi colleghi dell'opposizione:,Divina
2814,«Parte delle opposizioni gli ex dc oggi in Forza Italia e Udc ormai hanno dimostrato di sentirsi più vicini alla Margherita che al resto della casa delle libertà e in cambio di soldi ai gruppi si sono messi il cerotto sulla bocca».,"Forza Italia, Udc, Margherita, casa delle libertà"
2815,Tra i consiglieri di minoranza Pino Morandini (Udc) Cristano de Eccher (An) e Denis Bertolini (Lega) contrari agli aumenti ai gruppi hanno però trovato un accordo sulle regole d'aula.,"Pino Morandini, Udc, Cristano de Eccher, An, Denis Bertolini, Lega"
2816,«Quando si parlerà di soldi ai gruppi - spiega Bertolini in rotta con Divina - allora ci faremo sentire».,"Bertolini, Divina"
2817,Intanto ieri in Consiglio un gruppo di sostenitori di Divina ha appeso striscioni della Lega lanciato volantini incitando il consigliere.,"Divina, Lega"
2819,La Lega di Trento ha allestito un gazebo davanti al palazzo della Regione a cui si è unita parte di An.,"Lega, An"
2820,La maratona di Divina continua anche oggi.,Divina
2821,Il Coordinamento donne ad Andreolli:,"Coordinamento donne, Andreolli"
2826,Recentemente una delegazione del Coordinamento Donne di Trento si è incontrata con l'assessore alla Sanità della Provincia Remo Andreolli per avere una risposta in merito ai problemi sollevati a suo tempo dall'associazione sul rispetto della legge 194 in materia di interruzione della gravidanza e sul potenziamento dei consultori.,"Coordinamento Donne, Remo Andreolli"
2828,"«I dati del 2003 fornitici dall'assessorato - dice un comunicato dell'associazione - dicono che il 49% degli interventi all'Ospedale Santa Chiara viene effettuato dopo 21 giorni mentre Villa Bianca effettua il 36,2% degli interventi entro 5 - 9 giorni e il 40% entro 10 - 15 giorni».",Villa Bianca
2833,In questo senso ma anche per altri problemi il Coordinamento ha sollecitato Andreolli a passare dall'analisi dei dati ad una più concreta fase di attuazione dei passi operativi necessari a ridurre il disagio per le donne creando le condizioni perché venga rispettata e correttamente applicata la legge 194.,"Coordinamento, Andreolli"
2836,Da oggi sino alla fine di dicembre in piazza Duomo a Trento ci sarà «la Casetta del Volontariato» dove le associazioni di volontariato potranno farsi conoscere promuovere la loro attività e raccogliere fondi.,piazza Duomo
2837,A partire da oggi per una settimana in piazza Duomo sarà presente la cooperativa «La Rete» che dal 12 ottobre proporrà anche un corso sul volontariato dal titolo «Con e per la persona disabile e la sua famiglia».,"piazza Duomo, cooperativa « La Rete »"
2838,Tra i relatori ci saranno Lucio Babolin presidente del Coordinamento Nazionale Comunità di Accoglienza.,"Lucio Babolin, Coordinamento Nazionale Comunità di Accoglienza"
2839,L'iniziativa era già stata realizzata nel 2001 anno internazionale del volontariato nell'ambito del Mercatino di Natale di piazza Fiera.,piazza Fiera
2841,Nel mirino del Carroccio soprattutto provvedimenti per il ministero dell'Ambiente,"Carroccio, ministero dell' Ambiente"
2842,Finanziaria la Lega irrita Fini,"Lega, Fini"
2843,An contraria allo stralcio accolto da Casini,"An, Casini"
2844,Riforme Calderoli prepara la «blindatura»,Calderoli
2845,ROMA - Scontro nella maggioranza sullo stralcio di 17 norme dalla Finanziaria richiesto e ottenuto dalla Lega.,Lega
2846,Il presidente della Camera Pier Ferdinando Casini ha depennato dalla manovra i 17 provvedimenti segnalati dal leghista Gianfranco Giorgetti e subito il vicepremier Fini ha attaccato il Carroccio accusandolo di minare la solidità della maggioranza.,"Camera, Pier Ferdinando Casini, Gianfranco Giorgetti, Fini, Carroccio"
2848,Una decisione presa da Casini dietro parere della commissione Bilancio ma che ha provocato la reazione del leader di An che ha attaccato il leghista Giorgetti presidente della commissione Bilancio.,"Casini, commissione Bilancio, An, Giorgetti, commissione Bilancio"
2849,In commissione la mediazione trovata rguardava i termini della richiesta di stralcio a Casini:,Casini
2850,non più perentori ma lasciando alla presidenza della Camera la valutazione se effettivamente i 17 commi incriminati fossero estranei alla finanziaria.,presidenza della Camera
2851,Casini ha annunciato in aula esattamente lo stralcio di tutte le norme indicate nel parere della commissione Bilancio.,"Casini, commissione Bilancio"
2852,Fini ha reagito con parole critiche:,Fini
2853,«Non è in discussione l'autonomia del presidente della Camera.,Camera
2854,È invece certamente discutibile che ad avanzare questa richiesta sia stato un esponente della Lega Giancarlo Giorgetti dopo che la Finanziaria è stata approvata dal Consiglio dei ministri con il consenso anche dei ministri della Lega».,"Lega, Giancarlo Giorgetti, Consiglio dei ministri, Lega"
2855,Frattanto prosegue il tour de force della Camera sulle riforme ma superati i primi due «scogli» della devolution e del Senato federale il ministro Roberto Calderoli pensa già al successivo passaggio del testo al Senato.,"Camera, Senato federale, Roberto Calderoli, Senato"
2856,Dopo l'«incidente» della bocciatura di un emendamento di maggioranza sull'innalzamento a quaranta degli anni necessari per essere eletti senatori il ministro del Carroccio manda un «allera» agli inquilini della Cdl di Palazzo Madama.,"Carroccio, Cdl"
2857,«C'è l'intenzione della maggioranza - sottolinea - di fare in modo che quello che uscirà dalla Camera sia il testo definitivo.,Camera
2859,Il centrosinistra dal canto suo continua a opporsi al testo in aula alla Camera ma al contempo cerca di provocare i senatori a ribellarsi alla riforma.,Camera
2860,«È del tutto evidente - sottolinea il capogruppo della Margherita alla Camera Pierluigi Castagnetti - che la maggioranza ha blindato la riforma e questa è anche la ragione per la quale sta in piedi ma non so se i senatori siano d'accordo...».,"Margherita, Camera, Pierluigi Castagnetti"
2861,Per Castagnetti dopo la bocciatura della modifica sull'età dei senatori «al Senato il testo verrà cambiato».,"Castagnetti, Senato"
2862,La scelta della blindatura del testo tra l'altro per il presidente dei deputati dielle «la dice lunga sulla volontà di dialogo da parte del centrodestra».,dielle
2863,Un dialogo che per il presidente della Margherita Francesco Rutelli potrà esserci solo nel caso in cui la Cdl decida di stoppare il testo.,"Margherita, Francesco Rutelli, Cdl"
2866,Approda oggi in commissione del consiglio provinciale il testo di riforma sulla ricerca elaborato dall'assessore Gianluca Salvatori.,"consiglio provinciale, Gianluca Salvatori"
2867,La riforma prevede la trasformazione dell'Itc e dell'Istituto agrario di San Michele in fondazioni e l'introduzione di maggiore autonomia e flessibilità nel lavoro di ricerca.,"Itc, Istituto agrario di San Michele"
2871,Sembra essere questo insomma il principio ispiratore della legge provinciale di riforma con la quale verrà trasformato l'Itc (ed il suo statuto) destinato a diventare Fondazione Bruno Kessler in onore al suo promotore.,"Itc, Fondazione Bruno Kessler"
2872,«Viene meno la completa discrezionalità della giunta in merito alle nomine di sua competenza» spiega l'assessore all'innovazione Gianluca Salvatori.,Gianluca Salvatori
2873,«Questa scelta dimostra quanto siano infondate le obiezioni circa il rischio dell'appiattimento dell'autonomia dell'ente» aggiunge Salvatori.,Salvatori
2874,Quindi le vecchie regole (non scritte) sulle nomine di partito vengono cancellate da quelle (scritte questa volta) che garantiscono equilibri più coerenti con le finalità dell'istituto adesso e della fondazione poi.,"istituto, fondazione"
2879,Di DANIELE BATTISTEL,DANIELE BATTISTEL
2880,Marco ma il nome è di fantasia adolescente che abita a Trento sud e va a scuola in centro la linea 17 del servizio pubblico (quella che ha capolinea a Lavis) non la usa mai.,Marco
2881,Eppure una ventina di giorni fa gli è arrivata a casa la notifica da parte di Trentino trasporti per una contravvenzione di 31 euro e 40 centesimi per essere stato «beccato» sull'autobus 17 «sprovvisto di titolo di viaggio».,Trentino trasporti
2884,Quella sera di fine maggio il controllore presente sul bus ha fermato uno sconosciuto che ha fornito false generalità dando il nome e il cognome di Marco.,Marco
2885,L'addetto di Trentino trasporti non gli ha chiesto un documento d'identità (sulla contravvenzione è proprio scritto che il riconoscimento è avvenuto a voce) e così lo sconosciuto ha potuto farla franca.,Trentino trasporti
2886,Se ci fosse bisogno di una seconda conferma del fatto che il giovanotto sull'autobus non era Marco ecco il verbale in cui compare un indirizzo fasullo una data di nascita sbagliata e una firma del tutto diversa dalla sua.,Marco
2890,La segnalazione fatta da Marco è la pubblica denuncia che simili «scherzetti» possono accadere a tutti.,Marco
2891,Tornando al caso concreto al papà di Marco non è rimasto altro da fare che recarsi negli uffici di Trentino trasporti per chiedere informazioni.,"Marco, Trentino trasporti"
2892,Da via Marconi è stato dirottato al Top Center indirizzo del Servizio reti del Comune per avere informazioni su quali adempimenti burocratici fossero da portare a termine per ottenere l'annullamento del verbale.,"via Marconi, Servizio reti"
2896,«Una cosa che effettivamente può succedere se il controllore si limita al riconoscimento a voce senza controllare i documenti» gli hanno risposto gli stessi uffici di Trentino trasporti e del Comune.,Trentino trasporti
2897,La cosa buffa però è che gli uffici che notificano le contravvenzioni ben più solerti il disturbo di andare a fondo della questione se lo sono preso visto che partendo soltanto da un nome e un cognome sono risaliti all'indirizzo di Marco.,Marco
2898,Resta da capire però se anziché Marco il destinatario della multa fosse stato Mario Rossi a quale delle nove persone con questo nome che appaiono sull'elenco telefonico del Trentino avrebbero spedito la multa.,"Marco, Mario Rossi"
2906,Tanto che Marco che per tutto questo trambusto non se l'è presa più di tanto dall'«alto» della sua giovane età si sente di dare un consiglio ai controllori di viaggio:,Marco
2909,Aggredita da psicopatico cita l'Azienda,Azienda
2923,Adesso la donna aggredita e il marito hanno deciso di fare causa all'aggressore e all'Azienda sanitaria ritenendola responsabile perché era tenuta alla sorveglianza dell'uomo che soffriva da tempo da schizofrenia paranoide.,Azienda sanitaria
2925,Nei giorni scorsi l'atto di citazione è stato notificato all'Azienda sanitaria.,Azienda sanitaria
2926,Secondo il legale degli attori la ragione su cui si fonda la responsabilità sta nell'inadempimento da parte dell'Azienda sanitaria dell'obbligo di impedire il fatto dannoso.,Azienda sanitaria
2928,E cioè l'Azienda dal momento che secondo l'aggredita e il marito doveva sorvegliare il vicino visto che aveva dato più volte segni di instabilità psichica.,Azienda
2929,L'aggressore all'epoca dei fatti era soggetto a un trattamento medico psichiatrico proprio da parte dell'Azienda sanitaria.,Azienda sanitaria
2933,Nel 1996 aveva sparato contro l'auto dei carabinieri.,carabinieri
2935,Secondo l'aggredita però l'Azienda sanitaria non aveva mai fatto nulla per sorvegliare e limitare l'uomo.,Azienda sanitaria
2938,La patologia dell'uomo era nota da tempo all'Azienda e ai centri di salute mentale.,Azienda
2941,La giunta delle elezioni lo chiede,giunta delle elezioni
2943,La giunta delle elezioni del consiglio provinciale chiede la revisione della legislazione in materia di ineleggibilità e di incompatibilità.,"giunta delle elezioni, consiglio provinciale"
2944,Al termine del lungo esame che ha portato alla convalida di tutti gli eletti nella relazione finale presentata dal presidente Sandro Turella approvata con il voto contrario di An e l'astensione di Forza Italia nella parte riguardante Parolari i membri della giunta delle elezioni chiedono espressamente al consiglio di porre mano alla legge e di modificarla data la sua complessità e poca chiarezza.,"Sandro Turella, An, Forza Italia, Parolari, giunta delle elezioni, consiglio"
2945,«In considerazione delle difficoltà interpretative emerse connesse ad una formulazione generica della legislazione in materia di ineleggibilità e di incompatibilità» si legge nelle conclusioni «la giunta formula l'invito affinchè l'assemblea del consiglio provinciale si faccia parte attiva per una modifica di tale normativa.,"giunta, consiglio provinciale"
2946,"In particolare questa giunta evidenzia l'opportunità che venga chiarito il concetto di"" sussidi"" di cui all'articolo 16 rispetto a quello di"" finanziamenti"" di cui all'articolo 17 della legge provinciale N. 2 del 2003».",giunta
2947,Per il resto la relazione finale non porta novità se non il duro giudizio fatto mettere a verbale del consigliere di An Cristano de Eccher sull'eleggibilità di Giuseppe Parolari dei Ds.,"An, Cristano de Eccher, Giuseppe Parolari, Ds"
2948,Secondo de Eccher «i due pareri di Lutteri e di Mastragostino al di là delle conclusioni di segno opposto peraltro poco argomentate e convincenti confermano gli elementi di ineleggibilità a carico della situazione di Parolari.,"de Eccher, Lutteri, Mastragostino, Parolari"
2949,Infatti si riconosce pur fra mille inutili distinguo come l'Azienda sanitaria risulti effettivamente un ente funzionale della Provincia e soprattutto come Parolari abbia ricoperto un incarico con la qualifica di dirigente medico - direttore di struttura complessa.,"Azienda sanitaria, Parolari"
2951,«In sintesi - conclude de Eccher - appare quindi logico e corretto laddove ne sussistano come in questo caso le condizioni applicare la norma nella sua precisa e chiara formulazione evitando interpretazioni inopportune gratuite e soprattutto in grado di svilire ogni possibile certezza nel campo già di per sè difficile del diritto».,de Eccher
2952,Manuali loda Andreatta Maule critico,"Manuali, Andreatta, Maule"
2953,Intanto Chiogna promette:,Chiogna
2955,Di FRANCO GOTTARDI,FRANCO GOTTARDI
2958,Con Forza Italia che loda apertamente l'operato dell'assessore Andreatta mentre il suo compagno di partito Luigino Maule esprime tutta la sua delusione.,"Forza Italia, Andreatta, Luigino Maule"
2959,E intanto il capogruppo Beniamino Chiogna preannuncia l'intenzione della Margherita di essere comprensiva nei confronti dei privati quando si tratterà di valutare le loro osservazioni.,"Beniamino Chiogna, Margherita"
2961,Ha iniziato Armando Benedetti capogruppo del Centro che ha lamentato di essere stato completamente snobbato dai tre rappresentanti di minoranza in commissione urbanistica lasciato all'oscuro di quanto andava maturando.,"Armando Benedetti, Centro, commissione urbanistica"
2962,«Io e la mia collega Ferrari ci riserveremo perciò di decidere autonomamente come votare» ha preannunciato.,Ferrari
2963,Anche Giorgio Manuali ha fatto sapere che Forza Italia valuterà nel corso del dibattito.,"Giorgio Manuali, Forza Italia"
2969,Ma il diessino Stefano Albergoni a microfono spento accoglie l'atteggiamento forzista con imbarazzo:,Stefano Albergoni
2971,Giuseppe Filippin da parte sua non ha resistito alla tentazione di punzecchiare il leader forzista:,Giuseppe Filippin
2974,Ha indicato nel via libera a due edificazioni in zona di tutela del centro storico a Villamontagna il primo tradimento dei famosi criteri che si era data la commissione.,commissione
2976,Quanto alla maggioranza di centrosinistra l'intervento più favorevole quello di Beniamino Chiogna è anche quello che insinua dubbi sulla tenuta del quadro complessivo della variante.,Beniamino Chiogna
2977,Dopo aver lodato il provvedimento nel suo insieme il capogruppo della Margherita tocca un tasto delicatissimo quello delle richieste dei privati per rassicurarli («non è l'ultimo treno») e promettere:,Margherita
2979,Dichiarazioni che hanno stimolato la replica di Leo Vilardi:,Leo Vilardi
2981,Se così fosse dovremmo sventrare l'operato della commissione urbanistica».,commissione urbanistica
2982,Anche la diessina Lucia Maestri in precedenza aveva stuzzicato la Margherita per il suo «battage elettorale» legato alla questione delle domande dei privati nell'ambito di una critica al metodo di costruzione della variante:,"Lucia Maestri, Margherita"
2985,E l'altro diessino Michelangelo Marchesi ha ribadito la sua critica per le spinte esercitate da alcuni consiglieri interessamenti che considera poco etici rispetto a quello che dovrebbe essere il ruolo di un consigliere.,Michelangelo Marchesi
2986,Prima di loro era intervenuto Luigino Maule della Margherita deluso per le scelte su indici sottotetti e perequazione del lungo Salè e ancora dubbioso sul voto finale:,"Luigino Maule, Margherita, Salè"
2989,Iannotta (Itc):,"Iannotta, Itc"
2991,Domani giornata di studio organizzata dal gruppo provinciale della Sdr per approfondire i «nodi» della riforma,gruppo provinciale della Sdr
2992,Ricerca qualche idea per Salvatori,Salvatori
2995,La Sinistra democratica e riformista vuole offrire la possibilità di migliorare il disegno di legge presentato dall'assessore Salvatori».,"Sinistra democratica e riformista, Salvatori"
2996,Mauro Bondi consigliere provinciale e segretario dei Ds ha presentato ieri mattina assieme a Paolo Barbacovi capogruppo della Sdr Marco Battisti e Salvatore Iannotta rappresentante dei ricercatori nel Cda dell'Itc il convegno su ricerca e innovazione organizzato dal gruppo consiliare della Sdr che si terrà domani dalle 9 alle 18 nella sala rosa della Regione in cui verranno messe a confronto leggi e politiche su ricerca e innovazione di Campania Toscana ed Emilia Romagna.,"Mauro Bondi, Ds, Paolo Barbacovi, Sdr, Marco Battisti, Salvatore Iannotta, Cda, Itc, gruppo consiliare della Sdr"
